cleaned_title,keyword,published
thermax acquires chemicals maker buildtech crore businessline,construction chemicals,"Mon, 28 Oct 2024 07:00:00 GMT"
master builders enters chemicals realty plus magazine,construction chemicals,"Fri, 24 Jan 2025 08:00:00 GMT"
arkema global,construction chemicals,"Mon, 16 Nov 2020 14:01:56 GMT"
acquires chemicals fosroc tradearabia,construction chemicals,"Mon, 10 Mar 2025 05:06:33 GMT"
sika buy former basf chemicals lone star bln reuters,construction chemicals,"Thu, 11 Nov 2021 08:00:00 GMT"
sika acquires dominican concrete vinaldom swi,construction chemicals,"Fri, 02 Aug 2024 07:00:00 GMT"
st gobain see financial impact eu chemicals cartel probe reuters,construction chemicals,"Wed, 18 Oct 2023 07:00:00 GMT"
steve williams appointed president newly created chemicals unit wire,construction chemicals,"Mon, 17 Oct 2022 07:00:00 GMT"
vura aims set new manufacturing facilities indian chemical,construction chemicals,"Fri, 21 Feb 2025 12:50:04 GMT"
chemicals maker sika flags reuters,construction chemicals,"Fri, 16 Feb 2024 08:00:00 GMT"
expands chemicals portfolio fosroc buyout mep,construction chemicals,"Tue, 11 Feb 2025 08:00:00 GMT"
future chemicals advanced deloitte,construction chemicals,"Wed, 20 Mar 2019 16:41:34 GMT"
armosil west cements leadership chemicals prestigious award nigeria,construction chemicals,"Mon, 17 Mar 2025 07:00:00 GMT"
chemicals poised globenewswire,construction chemicals,"Thu, 03 Aug 2023 07:00:00 GMT"
thermax acquire buildtech rs crore et realty,construction chemicals,"Sat, 26 Oct 2024 07:00:00 GMT"
chemicals size share grand view,construction chemicals,"Sun, 06 Mar 2016 09:42:56 GMT"
thermax acquires buildtech expand chemicals manufacturing,construction chemicals,"Sun, 27 Oct 2024 07:00:00 GMT"
buy chemical maker gcp,construction chemicals,"Tue, 07 Dec 2021 08:00:00 GMT"
eu raids chemical firms cartel abuse concerns bloomberg,construction chemicals,"Tue, 17 Oct 2023 07:00:00 GMT"
basf wraps chemicals powder bulk solids,construction chemicals,"Sun, 12 Nov 2023 18:26:57 GMT"
chemicals optimizes customer pros,construction chemicals,"Wed, 12 Jul 2023 07:00:00 GMT"
chemicals set reach globenewswire,construction chemicals,"Wed, 04 Oct 2023 07:00:00 GMT"
arkema acquires arc specialized adhesives sealants arkema global,construction chemicals,"Wed, 13 Dec 2023 08:00:00 GMT"
lone star funds acquire chemicals tunnel magazine,construction chemicals,"Mon, 06 Jan 2020 08:00:00 GMT"
un warns copper shortage risks slowing global energy shift un,material shortage,"Fri, 09 May 2025 20:53:13 GMT"
raw shortages lingering issues remain chain management review,material shortage,"Tue, 07 Jan 2025 08:00:00 GMT"
ways manage shortages smart way meet chain slas celonis,material shortage,"Thu, 12 Sep 2024 07:00:00 GMT"
shortage atlantic,material shortage,"Mon, 03 Feb 2025 08:00:00 GMT"
rough seas delay poonthura offshore geotube breakwater project times,material shortage,"Sun, 11 May 2025 15:29:00 GMT"
education gap shortage realcleareducation,material shortage,"Wed, 05 Feb 2025 08:00:00 GMT"
port strike could reignite toilet paper shortage expert nc state university,material shortage,"Wed, 02 Oct 2024 07:00:00 GMT"
chain shortages impact manufacturing global trade magazine,material shortage,"Fri, 20 Sep 2024 07:00:00 GMT"
ato shortage wait times lagging us plastics,material shortage,"Wed, 23 Apr 2025 07:00:00 GMT"
destruction hits major semiconductor mineral axios,material shortage,"Tue, 01 Oct 2024 07:00:00 GMT"
global chip everything need know techrepublic,material shortage,"Fri, 06 Sep 2024 07:00:00 GMT"
export curbs semiconductor fuel chip shortage fears euronews,material shortage,"Tue, 27 Aug 2024 07:00:00 GMT"
homebuilders feeling pessimistic future sales,material shortage,"Thu, 20 Feb 2025 08:00:00 GMT"
raw shortage operational losses downstream tough choices secondary lead smelters smm shanghai metals,material shortage,"Thu, 17 Apr 2025 12:59:11 GMT"
combat losses manpower challenges underscore importance ukraine international institute strategic studies,material shortage,"Mon, 10 Feb 2025 08:00:00 GMT"
essential element power grid critically short ieee spectrum,material shortage,"Wed, 11 Dec 2024 08:00:00 GMT"
straw shortage threatening thatched sawtry thatcher bbc,material shortage,"Tue, 28 Jan 2025 08:00:00 GMT"
copper fluctuate decline secondary copper raw shortage drives suppliers stand quotes secondary copper daily smm shanghai metals,material shortage,"Tue, 04 Mar 2025 08:00:00 GMT"
procurement suppresses secondary copper raw transaction increased imports fail alleviate raw shortage dilemma weekly review secondary copper raw smm shanghai metals,material shortage,"Fri, 28 Feb 2025 08:16:56 GMT"
brass rod heats amid rising raw shortage chemanalyst,material shortage,"Fri, 11 Apr 2025 09:38:53 GMT"
rare earths controls prompt fears auto shortages shutdowns financial times,material shortage,"Sat, 19 Apr 2025 07:00:00 GMT"
alumina shortage drives,material shortage,"Thu, 22 Aug 2024 07:00:00 GMT"
nickel largest nickel producer cuts production stainless espresso,material shortage,"Tue, 01 Oct 2024 07:00:00 GMT"
shortage looms critical battery raw mckinsey northern miner,material shortage,"Mon, 30 Dec 2024 08:00:00 GMT"
rate cuts might make cheaper buy fix us housing biggest problem insider,material shortage,"Sat, 21 Sep 2024 07:00:00 GMT"
porsche supplier factory flood leads aluminum shortage chain dive,material shortage,"Tue, 30 Jul 2024 07:00:00 GMT"
sritex avoids layoffs amid furloughs due shortage jakarta globe,material shortage,"Wed, 13 Nov 2024 08:00:00 GMT"
highway likely face shortage kathmandu post,material shortage,"Wed, 19 Mar 2025 07:00:00 GMT"
units uddanam face shutdown amid shortage raw new indian express,material shortage,"Thu, 08 May 2025 04:43:10 GMT"
thousands nhs patients miss cancer tests due shortages lab closures independent,material shortage,"Sun, 08 Sep 2024 07:00:00 GMT"
sunflower oil factory shutdown due raw shortage odessa,material shortage,"Mon, 27 Jan 2025 08:00:00 GMT"
record number builders shortages national home builders nahb,material shortage,"Wed, 02 Jun 2021 07:00:00 GMT"
ukraine suffers shortage professionals offer ways solve,material shortage,"Mon, 15 Jul 2024 22:27:06 GMT"
gazipur factory shuts dollar raw shortage dhaka tribune,material shortage,"Thu, 09 Jan 2025 08:00:00 GMT"
russia face shortage weapons war ukraine isw  ,material shortage,"Mon, 16 Sep 2024 07:00:00 GMT"
ubc bookstore sees communication problems ubyssey,material shortage,"Wed, 23 Oct 2024 07:00:00 GMT"
coconut struggles unregulated exports cause raw shortage jakarta globe,material shortage,"Thu, 19 Dec 2024 08:00:00 GMT"
israel grapples ammunition shortage amid global arms restrictions ctech,material shortage,"Wed, 10 Jul 2024 07:00:00 GMT"
may face iron ore shortage gmk center,material shortage,"Thu, 24 Oct 2024 07:00:00 GMT"
copper smelters eye output cuts raw tightens,material shortage,"Thu, 18 Jul 2024 07:00:00 GMT"
rubber ends higher concerns raw shortage bernama,material shortage,"Mon, 14 Apr 2025 09:08:44 GMT"
b tu faces shortage seafood processing amid huge overseas,material shortage,"Thu, 13 Mar 2025 07:00:00 GMT"
ac faces raw chain bluestar md moneycontrol,material shortage,"Wed, 26 Jun 2024 07:00:00 GMT"
household cables drive copper shortage network,material shortage,"Fri, 29 Nov 2024 08:00:00 GMT"
russia working way raw target within grasp yet coatings world,material shortage,"Sat, 05 Aug 2023 07:00:00 GMT"
crisis brands making tough choices raw shortages modern retail,material shortage,"Fri, 25 Jun 2021 07:00:00 GMT"
power ambitions could take hit due transformer steel shortage moneycontrol,material shortage,"Wed, 30 Oct 2024 07:00:00 GMT"
aluminium climbs raw shortage triggers fund buying recorder,material shortage,"Wed, 23 Oct 2024 07:00:00 GMT"
lack red earth hinders nh work times,material shortage,"Wed, 23 Oct 2024 07:00:00 GMT"
automotive faces long term raw tavares reuters,material shortage,"Tue, 10 May 2022 07:00:00 GMT"
fashion faces massive shortage sustainable raw fashion,material shortage,"Thu, 26 Oct 2023 07:00:00 GMT"
shortage disruptive factor chain executive,material shortage,"Thu, 13 Jan 2022 08:00:00 GMT"
manufacturing gains raw labor shortages mounting reuters,material shortage,"Tue, 01 Jun 2021 07:00:00 GMT"
number ongoing us drug shortages reaches new pharmacist fierce pharma,material shortage,"Thu, 11 Apr 2024 07:00:00 GMT"
complementary methods diagnosis times shortage nature,material shortage,"Mon, 07 Jun 2021 07:00:00 GMT"
chain challenges shortage management chain leaders radar celonis,material shortage,"Fri, 08 Sep 2023 07:00:00 GMT"
labor shortage costs still hammering new home,material shortage,"Tue, 20 Jul 2021 07:00:00 GMT"
planning buy big change price happen soon kerala kaumudi,material shortage,"Mon, 10 Mar 2025 13:00:47 GMT"
bmw chip raw hit second half reuters,material shortage,"Tue, 03 Aug 2021 07:00:00 GMT"
infrastructure australia highlight quarry shortage,material shortage,"Thu, 18 Jul 2024 07:00:00 GMT"
accountant shortage weakness going concern,material shortage,"Fri, 14 Jul 2023 07:00:00 GMT"
shortages expected tight chain dive,material shortage,"Mon, 31 Jan 2022 08:00:00 GMT"
pfizer run penicillin supplies limited much letter fierce pharma,material shortage,"Wed, 14 Jun 2023 07:00:00 GMT"
pfizer cut vaccine production targets raw shortage pharmaphorum,material shortage,"Fri, 04 Dec 2020 08:00:00 GMT"
vietnam hit raw shortages disrupting industries vietnam briefing,material shortage,"Tue, 12 Jul 2022 07:00:00 GMT"
sustainable raw could exceed much tons boston consulting,material shortage,"Wed, 25 Oct 2023 07:00:00 GMT"
uniform shortage affect bmt graduates,material shortage,"Tue, 21 Dec 2021 08:00:00 GMT"
facing paint shortage cnbc,material shortage,"Tue, 08 Feb 2022 08:00:00 GMT"
chhatak factory grinds halt amid raw shortage united bangladesh,material shortage,"Wed, 26 Feb 2025 08:00:00 GMT"
aluminum shortage threatens us clean energy plans politico,material shortage,"Wed, 13 Mar 2024 07:00:00 GMT"
school districts scramble alternatives amid nationwide milk carton shortage katv,material shortage,"Fri, 03 Nov 2023 07:00:00 GMT"
nationwide milk carton shortage impacting schools rochester area,material shortage,"Mon, 30 Oct 2023 07:00:00 GMT"
shortage glass raw upended manufacturing modern retail,material shortage,"Mon, 21 Mar 2022 07:00:00 GMT"
titanium means aerospace industries thomasnet,material shortage,"Mon, 18 Dec 2023 08:00:00 GMT"
threatened electric car makers race supplies lithium batteries ap,material shortage,"Tue, 27 Jun 2023 07:00:00 GMT"
chain shortage slowing homebuilding insider,material shortage,"Thu, 13 Jan 2022 08:00:00 GMT"
rics addresses global labour shortages digital,material shortage,"Thu, 30 May 2024 07:00:00 GMT"
critical mineral shortages could disrupt global chains government accountability office,material shortage,"Tue, 21 Jun 2022 07:00:00 GMT"
ford suspend production friday mexico plant shortage reuters,material shortage,"Thu, 14 Oct 2021 07:00:00 GMT"
addressing continued chain mckinsey,material shortage,"Wed, 03 Apr 2024 07:00:00 GMT"
global electric vehicle chains struggle keep continues surge fastmarkets,material shortage,"Wed, 13 Sep 2023 07:00:00 GMT"
manufacturer solving magnet shortage national manufacturers nam,material shortage,"Wed, 31 Jan 2024 08:00:00 GMT"
shortages flagged ev lithium cobalt reuters,material shortage,"Thu, 01 Jul 2021 07:00:00 GMT"
skilled labour inferior fueling housing onigbide nigeria,material shortage,"Mon, 23 Sep 2024 07:00:00 GMT"
accountant shortage showing financial wsj,material shortage,"Tue, 11 Jul 2023 07:00:00 GMT"
indus motor suspends operations due raw shortage mettis global,material shortage,"Tue, 26 Nov 2024 08:00:00 GMT"
tupperware delays filing annual results amid accountant shortage wsj,material shortage,"Fri, 29 Mar 2024 07:00:00 GMT"
shortage leading delays kjzz,material shortage,"Fri, 04 Jun 2021 07:00:00 GMT"
despite contribution high costs heighten housing shortage tribune online,material shortage,"Mon, 30 Dec 2024 08:00:00 GMT"
shortages inflexible give rise high power transformer lead times wood mackenzie,material shortage,"Tue, 02 Apr 2024 07:00:00 GMT"
shortage causes delay bingham high school ksl newsradio,material shortage,"Tue, 03 Aug 2021 07:00:00 GMT"
drug shortage put lives experts warn abc,material shortage,"Wed, 07 Feb 2024 08:00:00 GMT"
slow waiting new house usa,material shortage,"Thu, 16 Jun 2022 07:00:00 GMT"
increased turnaround time repair linked shortage wgxa,material shortage,"Mon, 21 Jun 2021 07:00:00 GMT"
shortage mro capacity manufacturers scrambling aviation international,material shortage,"Mon, 04 Dec 2023 08:00:00 GMT"
five steps solving metals shortage bcg boston consulting,material shortage,"Thu, 06 Jul 2023 07:00:00 GMT"
chhatak factory grinds halt amid raw shortage financial express first financial daily bangladesh,material shortage,"Wed, 26 Feb 2025 18:00:00 GMT"
tesla gm prep predicted shortage ev battery production repairer driven,material shortage,"Thu, 21 Apr 2022 07:00:00 GMT"
build shortage hampers huntsville,material shortage,"Mon, 23 Aug 2021 07:00:00 GMT"
school districts scramble alternatives amid nationwide milk carton shortage wrgb,material shortage,"Tue, 31 Oct 2023 07:00:00 GMT"
backlog hits nearly high despite tariff worries dive,price increase construction,"Wed, 14 May 2025 14:16:35 GMT"
akron school board discuss options price new kenmore school goes akron beacon,price increase construction,"Tue, 13 May 2025 22:06:23 GMT"
construct home rose significantly last two national home builders nahb,price increase construction,"Wed, 29 Jan 2025 08:00:00 GMT"
airport terminal despite price increase black hills pioneer,price increase construction,"Fri, 09 May 2025 09:00:00 GMT"
tariff jitters trigger price cuts new houses twin cities star tribune,price increase construction,"Mon, 12 May 2025 19:07:48 GMT"
school costs already tariffs could drive boston globe,price increase construction,"Mon, 12 May 2025 08:50:57 GMT"
albany new home rise tariff costs squeeze builders journals,price increase construction,"Mon, 12 May 2025 21:03:00 GMT"
planning renovate may soon due tariffs cnn,price increase construction,"Wed, 14 May 2025 10:00:00 GMT"
roofing feels port pinch despite tariff truce roofing contractor magazine,price increase construction,"Tue, 13 May 2025 04:00:00 GMT"
home builders trump tariffs raising costs new york times,price increase construction,"Sat, 15 Feb 2025 08:00:00 GMT"
costs land soared price continues ,price increase construction,"Wed, 14 May 2025 01:52:37 GMT"
allocating risk tariff price increases planning united states mondaq,price increase construction,"Mon, 28 Apr 2025 07:00:00 GMT"
tariff worries force firms rethink contracts dive,price increase construction,"Tue, 25 Feb 2025 08:00:00 GMT"
important terms price escalation clauses mitigate inflationary effect tariffs,price increase construction,"Wed, 12 Feb 2025 08:00:00 GMT"
costs likely soar hochul touts affordability focus times union,price increase construction,"Sun, 26 Jan 2025 08:00:00 GMT"
map shows dropping newly built homes builders target smaller floor plans,price increase construction,"Thu, 08 May 2025 10:08:44 GMT"
residential inputs price slows eye housing,price increase construction,"Tue, 14 Jan 2025 08:00:00 GMT"
international costs arcadis,price increase construction,"Tue, 13 May 2025 05:35:06 GMT"
home renovations could skyrocket price tariffs take effect,price increase construction,"Mon, 12 May 2025 12:33:45 GMT"
price equipment statista,price increase construction,"Fri, 14 Mar 2025 07:00:00 GMT"
releases energy drive costs higher october,price increase construction,"Thu, 14 Nov 2024 08:00:00 GMT"
firms brace increased costs crude oil,price increase construction,"Thu, 17 Apr 2025 07:00:00 GMT"
rate price rise higher january yield pro,price increase construction,"Sun, 16 Feb 2025 08:00:00 GMT"
equipment price increases leveling equipment,price increase construction,"Fri, 15 Nov 2024 08:00:00 GMT"
managers grapple risk trump tariff era bisnow,price increase construction,"Tue, 18 Mar 2025 07:00:00 GMT"
international comparison recovery global sector remains illusive,price increase construction,"Tue, 13 May 2025 06:11:24 GMT"
price rush buy uncertainty wake trump tariffs fed reuters,price increase construction,"Wed, 23 Apr 2025 07:00:00 GMT"
developers fear tariffs could raise price wxii,price increase construction,"Thu, 10 Apr 2025 07:00:00 GMT"
output slips new contracts sharply bbj budapest,price increase construction,"Wed, 14 May 2025 10:35:00 GMT"
costs real tariffs entering journals,price increase construction,"Wed, 19 Mar 2025 07:00:00 GMT"
price inputs residential slows august eye housing,price increase construction,"Thu, 19 Sep 2024 07:00:00 GMT"
expect homebuilders push back price increases suppliers morningstar,price increase construction,"Fri, 04 Apr 2025 07:00:00 GMT"
producer price index shows higher costs march record,price increase construction,"Fri, 11 Apr 2025 07:00:00 GMT"
rise iron steel see spikes enr,price increase construction,"Thu, 13 Mar 2025 07:00:00 GMT"
international costs arcadis,price increase construction,"Mon, 18 Nov 2024 04:24:42 GMT"
treasure coast ranked nationwide home price increase past decade treasure coast,price increase construction,"Tue, 28 Jan 2025 08:00:00 GMT"
impacts tariffs local home buyers kmvt,price increase construction,"Sat, 10 May 2025 04:40:00 GMT"
june marks highest yearly increase since february eye housing,price increase construction,"Fri, 12 Jul 2024 07:00:00 GMT"
kiplinger housing residential slows amid rising costs kiplinger,price increase construction,"Fri, 02 May 2025 07:00:00 GMT"
navigates trump tariff impacts steel crude oil,price increase construction,"Sat, 15 Feb 2025 08:00:00 GMT"
australian price outlook altus,price increase construction,"Wed, 04 Sep 2024 07:00:00 GMT"
analyzing tariff effects investments crude oil,price increase construction,"Thu, 13 Mar 2025 07:00:00 GMT"
condo developers bracing costs surge high tariffs yahoo finance,price increase construction,"Wed, 09 Apr 2025 07:00:00 GMT"
new existing home price gap shrinking eye housing,price increase construction,"Tue, 25 Feb 2025 08:00:00 GMT"
stagnation us productivity national bureau economic nber,price increase construction,"Sat, 01 Feb 2025 08:00:00 GMT"
average price sand gravel statista,price increase construction,"Wed, 19 Feb 2025 08:00:00 GMT"
could rise aluminum tariffs investopedia,price increase construction,"Wed, 12 Feb 2025 08:00:00 GMT"
tariffs lumber come terrible time housing fast,price increase construction,"Mon, 17 Mar 2025 07:00:00 GMT"
tariffs starting bite american builders insider,price increase construction,"Thu, 13 Mar 2025 07:00:00 GMT"
engineers strike protest price hike quarries hindu,price increase construction,"Mon, 12 May 2025 13:26:00 GMT"
new york firms urge caution price allege gouging journals,price increase construction,"Fri, 11 Apr 2025 07:00:00 GMT"
figure increases costs researchgate,price increase construction,"Thu, 14 Nov 2024 03:43:58 GMT"
outlook deloitte,price increase construction,"Mon, 04 Nov 2024 08:00:00 GMT"
housing costs high calmatters,price increase construction,"Tue, 15 Oct 2024 07:00:00 GMT"
rising metal cast shadow crude oil,price increase construction,"Fri, 13 Dec 2024 08:00:00 GMT"
rate cuts expected boost enr,price increase construction,"Wed, 20 Nov 2024 08:00:00 GMT"
us new home sales median house price highest since reuters,price increase construction,"Wed, 26 Feb 2025 08:00:00 GMT"
economic steel aluminum tariffs would mean little change gdp bigger risks downstream users global,price increase construction,"Wed, 12 Feb 2025 08:00:00 GMT"
us housing lumber mixed amid economic shifts fastmarkets,price increase construction,"Thu, 08 Aug 2024 07:00:00 GMT"
input abc pros,price increase construction,"Mon, 14 Oct 2024 07:00:00 GMT"
builders warn mass deportation plan would drive home costs nbc,price increase construction,"Sat, 19 Oct 2024 07:00:00 GMT"
increasing housing reducing costs barriers national conference state legislatures,price increase construction,"Fri, 07 Jun 2024 07:00:00 GMT"
tariffs could increase price home projects longview,price increase construction,"Fri, 04 Apr 2025 07:00:00 GMT"
expect price rises january roofing,price increase construction,"Tue, 17 Dec 2024 08:00:00 GMT"
uncertainty looms us housing wake trump tariffs abc,price increase construction,"Wed, 09 Apr 2025 07:00:00 GMT"
higher stay dive,price increase construction,"Thu, 01 Jun 2023 07:00:00 GMT"
california costs jump orange county register,price increase construction,"Wed, 11 Dec 2024 08:00:00 GMT"
new price jumps especially good dive,price increase construction,"Thu, 11 Apr 2024 07:00:00 GMT"
average sales price new homes sold united states statista,price increase construction,"Thu, 30 Jan 2025 08:00:00 GMT"
increase canadian lumber tariffs add new home,price increase construction,"Fri, 07 Mar 2025 08:00:00 GMT"
housing predictions real estate,price increase construction,"Wed, 18 Dec 2024 08:00:00 GMT"
price plummets national home builders nahb,price increase construction,"Tue, 16 Jan 2024 08:00:00 GMT"
national home builders nahb,price increase construction,"Mon, 16 May 2022 07:00:00 GMT"
residential price increase eye housing,price increase construction,"Fri, 16 Feb 2024 08:00:00 GMT"
aggregates price trends decade vary widely state state demolition recycling,price increase construction,"Thu, 18 Jul 2024 07:00:00 GMT"
chain price hikes ahead dive,price increase construction,"Mon, 14 Nov 2022 08:00:00 GMT"
look price bureau labor statistics,price increase construction,"Thu, 26 Aug 2021 07:00:00 GMT"
price hike make expensive trinidad tobago newsday,price increase construction,"Fri, 07 Feb 2025 08:00:00 GMT"
opinion american elevator explains housing costs skyrocketed new york times,price increase construction,"Mon, 08 Jul 2024 07:00:00 GMT"
price index february,price increase construction,"Tue, 18 Mar 2025 07:00:00 GMT"
costs build forbes,price increase construction,"Fri, 29 Sep 2023 07:00:00 GMT"
increase national home builders nahb,price increase construction,"Fri, 15 Apr 2022 07:00:00 GMT"
surge price affects lorry operators across hindu,price increase construction,"Mon, 17 Mar 2025 07:00:00 GMT"
price index f january,price increase construction,"Tue, 18 Feb 2025 08:00:00 GMT"
residential costs rising slowest annual pace corelogic australia,price increase construction,"Thu, 11 Jul 2024 07:00:00 GMT"
tariffs likely hit seven industries newsweek,price increase construction,"Tue, 26 Nov 2024 08:00:00 GMT"
retail grapples chain uncertainty delays globest,supply chain construction,"Fri, 09 May 2025 18:18:46 GMT"
state center chain management center frontier,supply chain construction,"Thu, 24 Oct 2024 07:00:00 GMT"
circular robots really build greener online,supply chain construction,"Wed, 14 May 2025 06:20:11 GMT"
beyond risk management helps resolve challenges risk insurance,supply chain construction,"Fri, 07 Feb 2025 08:00:00 GMT"
confronting modern slavery chain chain digital,supply chain construction,"Sat, 19 Oct 2024 07:00:00 GMT"
resilient chains amid tariff uncertainty ecri,supply chain construction,"Thu, 01 May 2025 01:59:17 GMT"
worries chain risks turn true far enr,supply chain construction,"Fri, 07 Mar 2025 08:00:00 GMT"
tariffs impact chains finance commerce,supply chain construction,"Thu, 13 Mar 2025 07:00:00 GMT"
contractors mitigate impact tariffs chain brain,supply chain construction,"Thu, 17 Apr 2025 07:00:00 GMT"
vestigas secures chain optimisation,supply chain construction,"Wed, 09 Apr 2025 07:00:00 GMT"
phl modernization boost resilience amid trade uncertainties businessworld online,supply chain construction,"Mon, 12 May 2025 16:31:02 GMT"
spot warning signs insolvency chain dentons,supply chain construction,"Thu, 09 Jan 2025 08:00:00 GMT"
prolift rigging launches strategic partnership blueprint chain aid center pr newswire,supply chain construction,"Wed, 26 Mar 2025 07:00:00 GMT"
measuring chain impact la fires asu,supply chain construction,"Tue, 21 Jan 2025 08:00:00 GMT"
navigating chain challenges beyond,supply chain construction,"Wed, 07 May 2025 11:22:01 GMT"
swiss startup scalera raises ai public procurement,supply chain construction,"Fri, 09 May 2025 07:59:50 GMT"
skanska chain sustainability expansion sustainability magazine,supply chain construction,"Wed, 29 Jan 2025 08:00:00 GMT"
invites firms join chain oxford mail,supply chain construction,"Sun, 11 May 2025 16:07:16 GMT"
new distribution center begin january chain park,supply chain construction,"Wed, 18 Dec 2024 08:00:00 GMT"
reshoring environmental support chain logistical optimization trc companies,supply chain construction,"Sun, 22 Dec 2024 15:06:43 GMT"
strategy chain considering government subsidies contract,supply chain construction,"Tue, 10 Sep 2024 07:00:00 GMT"
fixing center needs collaborative approach center dynamics,supply chain construction,"Fri, 04 Apr 2025 07:00:00 GMT"
got centre surges amid chain constraints briefing,supply chain construction,"Fri, 25 Apr 2025 09:38:54 GMT"
bechtel honors exceptional chain partners bechtel,supply chain construction,"Sun, 24 Nov 2024 08:00:00 GMT"
critical role esg due diligence sustainable chain thomson reuters tax accounting,supply chain construction,"Wed, 04 Dec 2024 08:00:00 GMT"
preconstruction ease chain challenges dive,supply chain construction,"Wed, 21 Aug 2024 07:00:00 GMT"
kaya chain intelligence platform closes pulse,supply chain construction,"Tue, 04 Feb 2025 08:00:00 GMT"
preventing loss damage gear within chain center frontier,supply chain construction,"Mon, 04 Nov 2024 08:00:00 GMT"
may solve chain bottlenecks dive,supply chain construction,"Wed, 28 Aug 2024 07:00:00 GMT"
chain turner townsend,supply chain construction,"Fri, 13 Dec 2024 08:00:00 GMT"
