cleaned_title,keyword,published
best intermountain health chain fulfillment center acute care pharmacy expansion enr,supply chain construction,"Mon, 25 Nov 2024 08:00:00 GMT"
skanska kicks chain sustainability school,supply chain construction,"Mon, 03 Feb 2025 08:00:00 GMT"
chain issues slowing general dynamics sub ceo defense,supply chain construction,"Wed, 23 Oct 2024 07:00:00 GMT"
key headwinds hurt housing nahb tells congress national home builders nahb,supply chain construction,"Tue, 04 Mar 2025 08:00:00 GMT"
delivering sustainable efficient chain,supply chain construction,"Mon, 28 Apr 2025 07:00:00 GMT"
analyzing resilience influencing factors prefabricated chain based methodology nature,supply chain construction,"Mon, 29 Jul 2024 07:00:00 GMT"
trump orders review wood chain dive,supply chain construction,"Mon, 03 Mar 2025 08:00:00 GMT"
defining chain visibility industrial projects frontiers,supply chain construction,"Mon, 01 Jul 2024 00:21:09 GMT"
chain issues slow wiu performing arts center tri states public radio tspr wium,supply chain construction,"Mon, 07 Oct 2024 07:00:00 GMT"
resilient approach inclusion djc,supply chain construction,"Mon, 14 Oct 2024 07:00:00 GMT"
optimism chain despite challenges,supply chain construction,"Fri, 20 Dec 2024 08:00:00 GMT"
optimising chain resilience modelling integration south researchgate,supply chain construction,"Mon, 17 Feb 2025 08:00:00 GMT"
digital awards digital collaboration shortlist management magazine,supply chain construction,"Mon, 12 May 2025 09:50:57 GMT"
sustainable chain deloitte,supply chain construction,"Tue, 03 Dec 2024 08:00:00 GMT"
intermodal strategic shoring gains logistics inbound logistics,supply chain construction,"Mon, 02 Dec 2024 08:00:00 GMT"
nea host conference excellence nuclear nuclear energy agency,supply chain construction,"Tue, 25 Mar 2025 07:00:00 GMT"
center continues despite bottlenecks dive,supply chain construction,"Mon, 08 Jul 2024 07:00:00 GMT"
chain unblocking flow productivity profitability contractor magazine,supply chain construction,"Fri, 09 Aug 2024 07:00:00 GMT"
figure chain et researchgate,supply chain construction,"Thu, 24 Oct 2024 03:38:34 GMT"
warehouse rates return levels chain xchange,supply chain construction,"Tue, 11 Feb 2025 08:00:00 GMT"
trump orders review wood chain chain dive,supply chain construction,"Sun, 02 Mar 2025 08:00:00 GMT"
look knox economic opportunities intel chain richland,supply chain construction,"Sun, 16 Mar 2025 07:00:00 GMT"
isg collapse bbc,supply chain construction,"Mon, 23 Sep 2024 07:00:00 GMT"
four ways navigate tariffs management magazine,supply chain construction,"Thu, 10 Apr 2025 07:00:00 GMT"
dhl chain center issued permit jacksonville daily record,supply chain construction,"Tue, 13 Aug 2024 07:00:00 GMT"
next trends pwc,supply chain construction,"Fri, 10 Jan 2025 05:01:26 GMT"
guide chain management autodesk,supply chain construction,"Tue, 08 Nov 2022 08:00:00 GMT"
talking procurement talent pipeline chain management review,supply chain construction,"Thu, 02 Jan 2025 08:00:00 GMT"
quantum chain mattr national institute standards,supply chain construction,"Tue, 06 Aug 2024 07:00:00 GMT"
delays arizona plant spark chain worries,supply chain construction,"Tue, 21 Jan 2025 08:00:00 GMT"
disruptions chain affect infrastructure,supply chain construction,"Wed, 21 Aug 2024 07:00:00 GMT"
navigating chain challenges beyond merchants,supply chain construction,"Fri, 04 Apr 2025 07:00:00 GMT"
costs national home builders nahb,supply chain construction,"Tue, 16 Jul 2024 07:00:00 GMT"
impact proposed tariffs equipment costs fixed asset advisory kroll,supply chain construction,"Mon, 17 Feb 2025 08:00:00 GMT"
chain resiliency uncertain world pwc,supply chain construction,"Tue, 13 Aug 2024 07:00:00 GMT"
energy chain challenges centre vinson elkins llp,supply chain construction,"Tue, 13 Aug 2024 07:00:00 GMT"
chain resilience ai mit review,supply chain construction,"Thu, 18 Jul 2024 07:00:00 GMT"
tsmc chain management forum presents awards outstanding suppliers taiwan semiconductor,supply chain construction,"Mon, 02 Dec 2024 08:00:00 GMT"
chain headaches persist pandemic dive,supply chain construction,"Thu, 29 Feb 2024 08:00:00 GMT"
take project management software learn hub,supply chain construction,"Thu, 20 Feb 2025 08:00:00 GMT"
tariffs could impact energy amid chain shifts center frontier,supply chain construction,"Thu, 03 Apr 2025 07:00:00 GMT"
new analyses chain fire protection,supply chain construction,"Tue, 04 Feb 2025 08:00:00 GMT"
blockchain based cold chain logistics platform gannan navel oranges enhance transparency efficiency frontiers,supply chain construction,"Sun, 13 Oct 2024 07:00:00 GMT"
hong kong developers form cut carbon emissions south morning post,supply chain construction,"Fri, 13 Sep 2024 07:00:00 GMT"
hii slashes financial outlook due contract chain issues defense,supply chain construction,"Thu, 31 Oct 2024 07:00:00 GMT"
assessing state center chains center knowledge,supply chain construction,"Mon, 12 Aug 2024 07:00:00 GMT"
global survey kpmg,supply chain construction,"Sun, 06 Oct 2024 07:00:00 GMT"
wef chain key net digital,supply chain construction,"Fri, 28 Jun 2024 07:00:00 GMT"
assembly rate optimizations coordination prefabricated chain government subsidies nature,supply chain construction,"Thu, 23 May 2024 07:00:00 GMT"
spending fell weighed interest rates,supply chain construction,"Tue, 02 Jul 2024 07:00:00 GMT"
nycedc seeks operator offshore wind chain program supports local suppliers entering growing offshore wind nycedc nyc edc,supply chain construction,"Tue, 25 Jun 2024 07:00:00 GMT"
colas cfo chain challenges journals,supply chain construction,"Wed, 08 Jan 2025 08:00:00 GMT"
sector key fight climate change world economic forum,supply chain construction,"Wed, 26 Jun 2024 07:00:00 GMT"
lasting impact australian sector turner townsend,supply chain construction,"Fri, 14 Jun 2024 07:00:00 GMT"
chain risk,supply chain construction,"Tue, 11 Jul 2023 07:00:00 GMT"
figure chain project researchgate,supply chain construction,"Sat, 26 Oct 2024 15:10:13 GMT"
south accounts share factory boom chain brain,supply chain construction,"Wed, 05 Jun 2024 07:00:00 GMT"
impact researchgate,supply chain construction,"Wed, 23 Oct 2024 19:34:56 GMT"
sustainable extracted seawater advanced science,green building materials,"Fri, 11 Apr 2025 07:00:00 GMT"
green reach usd driven sustainability northeast channel nebraska,green building materials,"Tue, 06 May 2025 14:46:00 GMT"
living fungus could make buildings sustainable new scientist,green building materials,"Wed, 16 Apr 2025 07:00:00 GMT"
sustainable boost green transition european environment agency,green building materials,"Mon, 30 Sep 2024 07:00:00 GMT"
sustainable groups release policy recommendations new administration address challenges commercial real estate green council,green building materials,"Tue, 24 Sep 2024 07:00:00 GMT"
green shaping future national home builders nahb,green building materials,"Wed, 13 Nov 2024 08:00:00 GMT"
global green predicted reach globenewswire,green building materials,"Mon, 07 Oct 2024 07:00:00 GMT"
align leed themes green council,green building materials,"Wed, 15 Jan 2025 08:00:00 GMT"
sustainable globenewswire,green building materials,"Mon, 06 Jan 2025 08:00:00 GMT"
green reach usd globenewswire,green building materials,"Thu, 26 Sep 2024 07:00:00 GMT"
green globenewswire,green building materials,"Thu, 16 Jan 2025 08:00:00 GMT"
innovations helping create buildings future world economic forum,green building materials,"Mon, 23 Sep 2024 07:00:00 GMT"
green buildings matter sustainalytics,green building materials,"Fri, 18 Oct 2024 07:00:00 GMT"
sustainable global,green building materials,"Fri, 08 Nov 2024 08:19:31 GMT"
sustainable record bn global globenewswire,green building materials,"Tue, 07 Jan 2025 08:00:00 GMT"
circularity greenbuild green council,green building materials,"Mon, 16 Sep 2024 07:00:00 GMT"
green adoption statistics certificates impact facts coolest gadgets,green building materials,"Wed, 07 May 2025 09:02:39 GMT"
school built sugarcane might change forever zme science,green building materials,"Fri, 25 Apr 2025 07:00:00 GMT"
build sustainable buildings tariffs new york,green building materials,"Wed, 07 May 2025 16:03:20 GMT"
labor shortages impacting green greener ideal,green building materials,"Sat, 30 Nov 2024 08:00:00 GMT"
crh ventures launches accelerator scale innovative startups shaping future built world wire,green building materials,"Mon, 21 Oct 2024 07:00:00 GMT"
sustainable advancements practices techspective,green building materials,"Tue, 23 Jul 2024 07:00:00 GMT"
future residential commercial arizona digital free press,green building materials,"Thu, 27 Feb 2025 08:00:00 GMT"
new ai tool aims improve potentially transforming urban sustainability world,green building materials,"Thu, 13 Feb 2025 08:00:00 GMT"
sustainable create better indoor climates network,green building materials,"Fri, 10 Jan 2025 08:00:00 GMT"
strategies green integrating evolutionary game seir models nature,green building materials,"Thu, 02 Jan 2025 08:00:00 GMT"
leading sustainable kaiser permanente,green building materials,"Wed, 16 Oct 2024 07:00:00 GMT"
green size set grow usd rising need green buildings boost technavio pr newswire,green building materials,"Tue, 02 Jul 2024 07:00:00 GMT"
constructing sports facilities using frontiers,green building materials,"Wed, 25 Dec 2024 01:26:21 GMT"
walls reshaping,green building materials,"Thu, 17 Apr 2025 07:00:00 GMT"
swedish startup receives funding transform waste green arcticstartup arcticstartup,green building materials,"Fri, 21 Feb 2025 08:00:00 GMT"
contra costa county administration wins prestigious certifications green award contra costa county,green building materials,"Fri, 13 Dec 2024 08:00:00 GMT"
applications green autodesk,green building materials,"Fri, 25 Oct 2024 07:00:00 GMT"
green booming worldwide,green building materials,"Fri, 25 Apr 2025 07:00:00 GMT"
updated harvard sustainable standards advance health equity harvard gazette,green building materials,"Fri, 15 Nov 2024 08:00:00 GMT"
epa unveils labels green dive,green building materials,"Fri, 09 Aug 2024 07:00:00 GMT"
new could advance sustainable network,green building materials,"Wed, 19 Mar 2025 07:00:00 GMT"
coromandel chemicals enters joint venture sakarni plaster phospho green krishi jagran,green building materials,"Wed, 14 May 2025 11:21:49 GMT"
sandra lupien gives keynote address green council west michigan annual leadership awards michigan state university,green building materials,"Thu, 19 Dec 2024 08:00:00 GMT"
top trends shaping green practices greener ideal,green building materials,"Wed, 08 Jan 2025 08:00:00 GMT"
great green makeover knowable magazine,green building materials,"Wed, 04 Dec 2024 08:00:00 GMT"
sustainable home could get expensive trump fast,green building materials,"Mon, 25 Nov 2024 08:00:00 GMT"
metro vancouver upgrades sustainable practices recycling product,green building materials,"Mon, 07 Apr 2025 07:00:00 GMT"
sustainable recycled recycled industrial wastes frontiers,green building materials,"Thu, 13 Feb 2025 19:43:41 GMT"
coromandel international jv sakarni plaster green rediff moneywiz,green building materials,"Tue, 13 May 2025 15:28:35 GMT"
sustainable size estimated globenewswire,green building materials,"Thu, 05 Sep 2024 07:00:00 GMT"
declare labels contribute greener,green building materials,"Fri, 09 Aug 2024 07:00:00 GMT"
build green build smart leader,green building materials,"Fri, 13 Sep 2024 07:00:00 GMT"
green practices unleash trillion potential,green building materials,"Fri, 12 Jul 2024 07:00:00 GMT"
university dayton roger glass center arts earns green council award university dayton,green building materials,"Mon, 18 Nov 2024 08:00:00 GMT"
green explore green council green council,green building materials,"Wed, 17 Jan 2024 08:00:00 GMT"
commitment sustainability,green building materials,"Mon, 20 Jan 2025 13:07:13 GMT"
top sustainable build better future autodesk,green building materials,"Fri, 24 May 2024 07:00:00 GMT"
green recycled surf boards planetizen,green building materials,"Wed, 19 Mar 2025 07:00:00 GMT"
sustainable swfl homes gulfshore life,green building materials,"Fri, 20 Sep 2024 07:00:00 GMT"
new recycler coming california produce sustainable using recycled food beverage cartons pr newswire,green building materials,"Wed, 29 Jan 2025 08:00:00 GMT"
sheets global surpass driven rising durable globenewswire,green building materials,"Thu, 23 Jan 2025 08:00:00 GMT"
new could revolutionize cool,green building materials,"Sat, 20 Jul 2024 07:00:00 GMT"
enhancing sustainable southwest exploring roles quantity surveyors frontiers,green building materials,"Tue, 08 Apr 2025 07:00:00 GMT"
straw waste turned green,green building materials,"Fri, 21 Feb 2025 08:00:00 GMT"
viglacera showcases green coverings us,green building materials,"Sat, 03 May 2025 07:00:00 GMT"
commercial green size grand view,green building materials,"Tue, 11 Feb 2025 05:11:59 GMT"
analyzing lifecycle sustainable azobuild,green building materials,"Fri, 14 Jun 2024 07:00:00 GMT"
program saved government trump killing fast,green building materials,"Thu, 06 Feb 2025 08:00:00 GMT"
crh lookout innovations new sustainable accelerator carbon herald,green building materials,"Tue, 22 Oct 2024 07:00:00 GMT"
industrial hemp takes center stage sustainable greenbuild globenewswire,green building materials,"Wed, 13 Nov 2024 08:00:00 GMT"
galvanized steel coil reach sales infrastructure accelerates tmr globenewswire,green building materials,"Tue, 04 Mar 2025 08:00:00 GMT"
developments sustainable insulation azocleantech,green building materials,"Tue, 12 Nov 2024 08:00:00 GMT"
advancing tech briefs,green building materials,"Tue, 09 Jul 2024 07:00:00 GMT"
gbi unveils updated green globes certification programs core shell sustainable interiors,green building materials,"Tue, 12 Nov 2024 08:00:00 GMT"
trends sustainable energy climate resilience leader,green building materials,"Thu, 16 Jan 2025 08:00:00 GMT"
climate tech could make cities sustainable world economic forum,green building materials,"Fri, 06 Dec 2024 08:00:00 GMT"
usgbc members greenbuild green council,green building materials,"Mon, 14 Oct 2024 07:00:00 GMT"
cambium raises replace carbon intensive sustainable wood esg,green building materials,"Wed, 26 Feb 2025 08:00:00 GMT"
overland park wants updated buildings greener johnson county post,green building materials,"Mon, 02 Dec 2024 08:00:00 GMT"
dcc green energy computing center green council,green building materials,"Thu, 13 Mar 2025 07:00:00 GMT"
green surge surpasses target reccessary,green building materials,"Fri, 14 Feb 2025 08:00:00 GMT"
peacehealth lynden clinic awarded leed silver certification green peacehealth,green building materials,"Mon, 30 Dec 2024 08:00:00 GMT"
sustainable incorporating green civil projects researchgate,green building materials,"Mon, 16 Dec 2024 08:00:00 GMT"
evaluating sustainable assessment comparative gbrs wblca frontiers,green building materials,"Thu, 13 Feb 2025 21:29:04 GMT"
preparing fleet green pros,green building materials,"Fri, 24 Jan 2025 08:00:00 GMT"
startup developing corncobs cannabis waste boston globe,green building materials,"Mon, 05 Aug 2024 07:00:00 GMT"
net zero target igbc leading sustainable green buildings anand exclusive et,green building materials,"Mon, 12 May 2025 08:00:16 GMT"
adapting green practices smart developing review researchgate,green building materials,"Thu, 03 Oct 2024 09:45:03 GMT"
enhancing sustainability innovative practices intelligent living,green building materials,"Sun, 17 Nov 2024 08:00:00 GMT"
steve leader sustainable enr,sustainable construction,"Fri, 09 May 2025 19:20:00 GMT"
mke supervisors push sustainable designs urban milwaukee,sustainable construction,"Tue, 13 May 2025 16:13:00 GMT"
na winners us architecture contest csrwire,sustainable construction,"Tue, 13 May 2025 14:15:51 GMT"
growing role steel sustainable green fmi northeast channel nebraska,sustainable construction,"Fri, 09 May 2025 00:54:00 GMT"
winners global award sustainable architecture,sustainable construction,"Tue, 06 May 2025 14:30:00 GMT"
suffolk hosts climate tech forum accelerate sustainable wire,sustainable construction,"Fri, 25 Apr 2025 07:00:00 GMT"
top sustainable companies sustainability magazine,sustainable construction,"Wed, 07 May 2025 10:24:15 GMT"
millions revolutionary bricks produced recycled waste achieving certification azocleantech,sustainable construction,"Mon, 12 May 2025 04:04:05 GMT"
sustainable canada global trends decrypted edition saint gobain barometer yahoo finance,sustainable construction,"Tue, 06 May 2025 19:10:00 GMT"
suffolk hosts climate tech forum drive sustainable boston real estate times,sustainable construction,"Fri, 25 Apr 2025 07:00:00 GMT"
stuckeman grad student focuses future sustainable penn state university,sustainable construction,"Mon, 14 Apr 2025 07:00:00 GMT"
xcmg machinery publishes esg pioneering sustainable global machinery travel daily,sustainable construction,"Wed, 14 May 2025 08:42:39 GMT"
sustainable barometer csrwire,sustainable construction,"Fri, 02 May 2025 12:44:10 GMT"
top sustainable projects sustainability magazine,sustainable construction,"Fri, 02 May 2025 07:00:00 GMT"
future uncertain intercollegiate sustainable competition wabe,sustainable construction,"Tue, 06 May 2025 21:57:36 GMT"
sustainable united states global trends decrypted edition barometer yahoo finance,sustainable construction,"Mon, 28 Apr 2025 07:00:00 GMT"
global award sustainable architecture announces laureates venice archdaily,sustainable construction,"Fri, 09 May 2025 08:30:00 GMT"
aerial robots offer sustainable methods tech xplore,sustainable construction,"Thu, 24 Apr 2025 07:00:00 GMT"
sustainable considerations next kansas project journals,sustainable construction,"Mon, 28 Apr 2025 07:00:00 GMT"
sustainable barometer yahoo finance,sustainable construction,"Thu, 01 May 2025 07:00:00 GMT"
owners remain bullish sustainability despite trump changes dive,sustainable construction,"Wed, 05 Mar 2025 08:00:00 GMT"
champions hall set standard sustainable centre college,sustainable construction,"Fri, 27 Sep 2024 07:00:00 GMT"
rethinking sand earth sustainable egypt frontiers,sustainable construction,"Thu, 24 Apr 2025 20:08:54 GMT"
turner remains committed advancing sustainable practices turner,sustainable construction,"Tue, 01 Apr 2025 07:00:00 GMT"
axa xl offers sustainable evaluation insurance,sustainable construction,"Thu, 06 Mar 2025 08:00:00 GMT"
school sugarcane waste signals new era sustainable brighter side,sustainable construction,"Mon, 28 Apr 2025 07:00:00 GMT"
thermal insulation key contributor energy efficiency sustainable fmiblog,sustainable construction,"Fri, 09 May 2025 10:06:38 GMT"
clean could create millions jobs drive inclusive new shows cities,sustainable construction,"Wed, 29 Jan 2025 08:00:00 GMT"
new could make concrete sustainable northwestern,sustainable construction,"Wed, 19 Mar 2025 07:00:00 GMT"
schoenecker center earns leed gold green newsroom university thomas,sustainable construction,"Mon, 28 Oct 2024 07:00:00 GMT"
fly ash sustainable nature,sustainable construction,"Fri, 20 Dec 2024 12:21:11 GMT"
auar creating sustainable facility robot,sustainable construction,"Mon, 03 Mar 2025 08:00:00 GMT"
holcim sustainable academy helps drive circular regenerative holcim,sustainable construction,"Mon, 30 Sep 2024 07:00:00 GMT"
call action sustainable sustainability magazine,sustainable construction,"Wed, 13 Nov 2024 08:00:00 GMT"
going global sustainable recycling,sustainable construction,"Tue, 11 Mar 2025 07:00:00 GMT"
missouri bill could force columbia abandon sustainable code requirements columbia missourian,sustainable construction,"Mon, 03 Mar 2025 08:00:00 GMT"
greener role sustainable interesting,sustainable construction,"Fri, 07 Mar 2025 08:00:00 GMT"
transforming waste sustainable united nations programme,sustainable construction,"Thu, 13 Feb 2025 20:48:28 GMT"
sustainable tracing commitment infrastructure miami student,sustainable construction,"Mon, 13 Jan 2025 08:00:00 GMT"
earth could transform sustainable conversation,sustainable construction,"Mon, 16 Dec 2024 08:00:00 GMT"
new green council details three decades impact green council,sustainable construction,"Thu, 14 Nov 2024 08:00:00 GMT"
holcim recognized slag advancing sustainable three projects pr newswire,sustainable construction,"Thu, 03 Apr 2025 07:00:00 GMT"
osu lead creation national center sustainable oklahoma state university,sustainable construction,"Mon, 22 Jul 2024 07:00:00 GMT"
innovative sustainable housing unit combines biochar burnt organic waste mortar,sustainable construction,"Thu, 08 May 2025 13:54:30 GMT"
top sustainable buildings sustainability magazine,sustainable construction,"Wed, 14 Aug 2024 07:00:00 GMT"
role sustainability azobuild,sustainable construction,"Thu, 22 Aug 2024 07:00:00 GMT"
usu engineer pioneers sustainable techniques using microbial utah state university,sustainable construction,"Tue, 19 Nov 2024 08:00:00 GMT"
sustainable include innovations alternative energy altenergymag,sustainable construction,"Mon, 11 Nov 2024 08:00:00 GMT"
sustainable future arcelormittal habitat commitment habitat humanity,sustainable construction,"Tue, 15 Oct 2024 11:31:24 GMT"
waste revolutionary green grout sustainable practices,sustainable construction,"Tue, 25 Feb 2025 08:00:00 GMT"
moranta smart sustainability hits new heights holcim,sustainable construction,"Wed, 16 Apr 2025 15:12:52 GMT"
leica geosystems sustainable,sustainable construction,"Tue, 08 Apr 2025 07:00:00 GMT"
global magnesium chloride boosted sustainable globenewswire,sustainable construction,"Mon, 13 Jan 2025 08:00:00 GMT"
reduce environmental impact sector anthesis,sustainable construction,"Fri, 20 Dec 2024 08:00:00 GMT"
innovations alternative energy sustainable,sustainable construction,"Tue, 14 Jan 2025 08:00:00 GMT"
green council launches comprehensive leed rating system sustainable buildings architect interiors,sustainable construction,"Sun, 11 May 2025 08:59:38 GMT"
amazon advances green achieve leader,sustainable construction,"Mon, 30 Dec 2024 08:00:00 GMT"
deep energy future sustainable buildings specifier,sustainable construction,"Wed, 16 Apr 2025 07:00:00 GMT"
reducing environmental impact concrete sustainable autodesk,sustainable construction,"Sat, 22 Mar 2025 20:46:03 GMT"
accelerating sustainable icons madrid holcim,sustainable construction,"Fri, 08 Nov 2024 09:03:29 GMT"
role sustainable energy network,sustainable construction,"Mon, 18 Nov 2024 08:00:00 GMT"
biodegradable lubricants support sustainable shell global,sustainable construction,"Fri, 21 Feb 2025 22:54:00 GMT"
greener future digital,sustainable construction,"Wed, 30 Oct 2024 07:00:00 GMT"
sustainable waste management frontiers,sustainable construction,"Tue, 01 Apr 2025 11:18:23 GMT"
top examples sustainable architecture,sustainable construction,"Fri, 21 Feb 2025 08:00:00 GMT"
holcim foundation sustainable holcim,sustainable construction,"Wed, 11 Dec 2024 08:00:00 GMT"
future sustainable buildings era doge propmodo,sustainable construction,"Tue, 04 Mar 2025 00:44:08 GMT"
chris roof specialist speak sustainable conference,sustainable construction,"Mon, 10 Feb 2025 08:00:00 GMT"
nordic sustainable results resonate eu nordic cooperation,sustainable construction,"Tue, 28 Jan 2025 08:00:00 GMT"
breakthrough sustainable bricks actually store carbon tencent,sustainable construction,"Thu, 06 Mar 2025 08:00:00 GMT"
embedding sustainable henning kritika kharbanda holcim,sustainable construction,"Tue, 21 Jan 2025 08:00:00 GMT"
need virtualisation sustainable autodesk,sustainable construction,"Thu, 05 Sep 2024 07:00:00 GMT"
new sustainable,sustainable construction,"Mon, 30 Dec 2024 08:00:00 GMT"
crh ventures launches accelerator scale innovative startups shaping future built world wire,sustainable construction,"Mon, 21 Oct 2024 07:00:00 GMT"
arup signs mou vietnam green council advance sustainable vietnam arup,sustainable construction,"Wed, 02 Apr 2025 07:00:00 GMT"
advancing sustainable belgium holcim,sustainable construction,"Thu, 07 Nov 2024 08:00:00 GMT"
dnr marks mass timber milestone newberry second wave michigan,construction materials,"Wed, 14 May 2025 13:08:20 GMT"
zacks outlook highlights quanex gibraltar industries aspen aerogels yahoo finance,construction materials,"Thu, 08 May 2025 09:53:00 GMT"
investing blocks economy britannica,construction materials,"Thu, 01 May 2025 07:00:00 GMT"
house cuts close burial site provincetown independent,construction materials,"Wed, 30 Apr 2025 07:00:00 GMT"
ontario doubles code supremacy,construction materials,"Wed, 14 May 2025 16:32:34 GMT"
move modestly higher yield pro,construction materials,"Thu, 16 Jan 2025 08:00:00 GMT"
cool roofs witness substantial,construction materials,"Tue, 13 May 2025 11:51:00 GMT"
office attendance nears costs howard hughes extends deal deadline costar,construction materials,"Tue, 15 Apr 2025 07:00:00 GMT"
tariffs appliances set stage higher costs new homes remodeling projects pbs,construction materials,"Mon, 17 Mar 2025 07:00:00 GMT"
natural gain attention california fires trellis,construction materials,"Mon, 03 Mar 2025 08:00:00 GMT"
circular economy nrel,construction materials,"Wed, 12 Feb 2025 08:00:00 GMT"
stifel nicolaus raises doman price target marketbeat,building materials,"Wed, 14 May 2025 18:37:48 GMT"
funding helps build new visitor center historic oakland cemetery csrwire,building materials,"Wed, 14 May 2025 14:20:47 GMT"
looking way try salvage union democrat,building materials,"Wed, 14 May 2025 16:25:00 GMT"
doman trading higher defense world,building materials,"Wed, 14 May 2025 06:49:08 GMT"
doman given new price target canaccord genuity marketbeat,building materials,"Wed, 14 May 2025 18:38:46 GMT"
