cleaned_title,keyword,published
skanska softens stance us despite solid briefing,construction market,"Wed, 14 May 2025 13:53:44 GMT"
telehandler share,construction market,"Wed, 14 May 2025 15:19:00 GMT"
australia size surpass usd,construction market,"Wed, 14 May 2025 06:42:00 GMT"
european center outlook globenewswire,construction market,"Wed, 14 May 2025 08:08:10 GMT"
wisconsin apprenticeships could grow faster wisconsin examiner,construction market,"Mon, 12 May 2025 10:33:08 GMT"
traffic control planned street redding krcr,construction market,"Mon, 12 May 2025 19:07:27 GMT"
geneva ranked costliest arcadis,construction market,"Tue, 13 May 2025 05:06:16 GMT"
center challenges,construction market,"Wed, 14 May 2025 07:33:00 GMT"
global safety net size emerging,construction market,"Wed, 14 May 2025 14:40:52 GMT"
rainscreen cladding size projected exceed usd globenewswire,construction market,"Wed, 14 May 2025 14:22:32 GMT"
hydraulic hammer driving,construction market,"Wed, 14 May 2025 07:35:00 GMT"
center globenewswire,construction market,"Mon, 12 May 2025 11:29:41 GMT"
saudi arabia bridge globenewswire,construction market,"Tue, 13 May 2025 08:33:14 GMT"
center prospect globenewswire,construction market,"Thu, 08 May 2025 08:17:34 GMT"
insurance aon insurance insider us,construction market,"Mon, 12 May 2025 21:59:29 GMT"
open gear lubricants globenewswire,construction market,"Tue, 13 May 2025 15:06:57 GMT"
may economist rising costs urban land magazine,construction market,"Tue, 13 May 2025 14:01:12 GMT"
roofing expands better serve texas communities,construction market,"Tue, 13 May 2025 22:08:00 GMT"
large firms abandon small projects amid rising companies pursue contracts chosun biz,construction market,"Wed, 14 May 2025 08:50:00 GMT"
precast prefabricated poised rapid expected reach usd,construction market,"Tue, 13 May 2025 16:45:00 GMT"
tempered glass grows rising across electronics sectors,construction market,"Wed, 14 May 2025 07:16:00 GMT"
global marsh,construction market,"Wed, 30 Apr 2025 07:00:00 GMT"
repair composites size,construction market,"Tue, 13 May 2025 13:11:16 GMT"
opportunities risks changing job dw,construction market,"Tue, 13 May 2025 19:07:30 GMT"
pipeline booming worldwide major giants fugro,construction market,"Mon, 12 May 2025 12:50:00 GMT"
content hub emgs enters subsea vessel acquisition,construction market,"Mon, 12 May 2025 12:32:14 GMT"
press release,construction market,"Thu, 01 May 2025 07:00:00 GMT"
wakecap closes expand wamda,construction market,"Tue, 13 May 2025 12:50:24 GMT"
australia new zealand pressure progress turner townsend,construction market,"Mon, 12 May 2025 07:00:00 GMT"
apac center globenewswire,construction market,"Mon, 05 May 2025 08:13:51 GMT"
tokyu revises management plan amid positive outlook tipranks,construction market,"Tue, 13 May 2025 08:22:50 GMT"
eu sector steadily outperforming us ing think economic financial ing think,construction market,"Thu, 08 May 2025 08:20:11 GMT"
global thermal insulation hit usd driven sustainable trends valuates pr newswire,construction market,"Mon, 12 May 2025 15:35:00 GMT"
tariff tensions threaten dive,construction market,"Fri, 11 Apr 2025 07:00:00 GMT"
autonomous launches heavy softbank prweb,construction market,"Mon, 05 May 2025 22:00:00 GMT"
modular chiller reach growing,construction market,"Tue, 13 May 2025 14:36:00 GMT"
chemicals expected grow period,construction market,"Tue, 13 May 2025 11:54:00 GMT"
builders deliver smaller affordable homes tariffs threaten progress,construction market,"Thu, 08 May 2025 10:21:08 GMT"
west side breaks ground first phase transformation project cleveland,construction market,"Mon, 12 May 2025 18:30:00 GMT"
crisis trade response frieden luxembourg times,construction market,"Wed, 14 May 2025 14:50:08 GMT"
soft ample keep bps pressure early may chemanalyst,construction market,"Tue, 13 May 2025 12:04:33 GMT"
navigating volatility jll,construction market,"Mon, 24 Mar 2025 07:00:00 GMT"
southeast center globenewswire,construction market,"Fri, 25 Apr 2025 07:00:00 GMT"
saudi arabia commercial driven vision sees significant government investments globenewswire,construction market,"Thu, 17 Apr 2025 07:00:00 GMT"
healthy gains expected phoenix enr,construction market,"Mon, 21 Apr 2025 07:00:00 GMT"
enr top owners tariff stuns enr,construction market,"Wed, 09 Apr 2025 07:00:00 GMT"
trends straits,construction market,"Mon, 10 Mar 2025 12:08:56 GMT"
housing map ranks efforts across us newsweek,construction market,"Mon, 28 Apr 2025 07:00:00 GMT"
southeast center globenewswire,construction market,"Fri, 25 Apr 2025 16:39:23 GMT"
chemicals booms rising infrastructure investments,construction market,"Tue, 13 May 2025 07:13:00 GMT"
homebuilder unsold inventory hits housing markets find deals resiclub,construction market,"Fri, 28 Mar 2025 07:00:00 GMT"
ireland competitive landscape,construction market,"Tue, 29 Apr 2025 07:00:00 GMT"
fleksihus expands uk,construction market,"Wed, 14 May 2025 09:01:16 GMT"
top impacting boat coming rising interest autonomous whatech,construction market,"Mon, 12 May 2025 07:49:13 GMT"
atlanta abuzz major projects enr,construction market,"Mon, 10 Feb 2025 08:00:00 GMT"
hokey making things difficult spectrum,construction market,"Wed, 16 Apr 2025 07:00:00 GMT"
rising wages workers shifting foundations housing conversation,construction market,"Wed, 30 Apr 2025 07:00:00 GMT"
center globenewswire,construction market,"Fri, 18 Apr 2025 07:00:00 GMT"
epoxy coatings sees strong driven environmental trends,construction market,"Tue, 13 May 2025 15:13:00 GMT"
markets see light end tunnel upturn fuelled modernised sustainable residential bain,construction market,"Thu, 09 Jan 2025 08:00:00 GMT"
builders unsold homes since housing markets deals fast,construction market,"Wed, 30 Apr 2025 07:00:00 GMT"
grows idtechex,construction market,"Thu, 01 May 2025 07:00:00 GMT"
marine size grand view,construction market,"Tue, 25 Feb 2025 07:52:42 GMT"
trade tensions could tariffs mean altus,construction market,"Wed, 26 Feb 2025 08:00:00 GMT"
uk sector costs pressure job cuts pmi shows reuters,construction market,"Fri, 04 Apr 2025 07:00:00 GMT"
home geography index national home builders nahb,construction market,"Tue, 04 Mar 2025 08:00:00 GMT"
personal protective equipment grand view,construction market,"Wed, 16 Apr 2025 09:48:19 GMT"
outlook lockton,construction market,"Wed, 12 Feb 2025 08:00:00 GMT"
printing expected reach globenewswire,construction market,"Wed, 29 Jan 2025 08:00:00 GMT"
precast global featuring balfour olson globenewswire,construction market,"Wed, 12 Mar 2025 07:00:00 GMT"
green size worth usd coherent globenewswire,construction market,"Tue, 08 Apr 2025 07:00:00 GMT"
new increasingly choice yahoo finance,construction market,"Thu, 08 May 2025 12:00:00 GMT"
holcim amrize targets robust us reuters,construction market,"Tue, 25 Mar 2025 07:00:00 GMT"
modular globenewswire,construction market,"Fri, 18 Apr 2025 07:00:00 GMT"
california challenges amid rising new administration nixon peabody llp,construction market,"Tue, 11 Feb 2025 08:00:00 GMT"
costly one challenge ahead la rebuilds wildfires laist,construction market,"Wed, 22 Jan 2025 08:00:00 GMT"
part state route close august new albany adds street roundabout columbus dispatch,construction market,"Mon, 05 May 2025 07:00:00 GMT"
emgs slides reveal major subsea expansion steady australia,construction market,"Tue, 13 May 2025 18:08:09 GMT"
volumetric size grand view,construction market,"Tue, 18 Feb 2025 07:31:38 GMT"
us pivotal moment turner townsend,construction market,"Mon, 09 Dec 2024 08:00:00 GMT"
saudi mortgage boom masks cracks property semafor,construction market,"Wed, 07 May 2025 12:13:00 GMT"
ag horizon agricultural remains pressure aem equipment manufacturers,construction market,"Wed, 13 Nov 2024 08:00:00 GMT"
kuwait competitive landscape,construction market,"Tue, 29 Apr 2025 07:00:00 GMT"
geberit ceo slightly positive us ahead trump term reuters,construction market,"Thu, 16 Jan 2025 08:00:00 GMT"
center outlook globenewswire,construction market,"Mon, 17 Feb 2025 08:00:00 GMT"
holcim affected upbeat ceo reuters,construction market,"Mon, 03 Feb 2025 08:00:00 GMT"
local leaders watchful tariffs roll beaumont enterprise,construction market,"Thu, 10 Apr 2025 07:00:00 GMT"
builder confidence falls uncertainty national home builders nahb,construction market,"Mon, 17 Mar 2025 07:00:00 GMT"
global clays expand anticipated reaching indexbox,construction market,"Sun, 11 May 2025 03:05:38 GMT"
paul affordable project lands loan multifamily housing,construction news,"Wed, 14 May 2025 08:40:20 GMT"
next stop washington near transit edmonds,construction news,"Wed, 14 May 2025 15:35:05 GMT"
wasena skatepark park kicks wsls,construction news,"Wed, 14 May 2025 13:58:30 GMT"
summer road greene county online,construction news,"Wed, 14 May 2025 12:39:00 GMT"
olney avenue intersection opening moving closer central oregon daily,construction news,"Tue, 13 May 2025 23:50:00 GMT"
pbk designing supportive secure early learning spaces school,construction news,"Tue, 13 May 2025 18:46:50 GMT"
illinois state university approves projects chicago,construction news,"Mon, 12 May 2025 16:32:51 GMT"
backlog reaches abc enr,construction news,"Tue, 13 May 2025 19:44:10 GMT"
roof collapse quinault water tower injures critically komo,construction news,"Wed, 14 May 2025 05:08:53 GMT"
fire station begin july state,construction news,"Wed, 14 May 2025 02:04:00 GMT"
fairfax selectboard enforces parking hunt street contentious meeting albans messenger,construction news,"Tue, 13 May 2025 21:15:00 GMT"
new highlights top challenges pros,construction news,"Tue, 13 May 2025 18:02:53 GMT"
russia egypt discuss lng terminals cairo al arabiya english,construction news,"Wed, 14 May 2025 12:44:00 GMT"
suspected dui driver injures worker car bursts flames kiro seattle,construction news,"Tue, 13 May 2025 13:15:18 GMT"
dlr leads new ohio high school school,construction news,"Tue, 13 May 2025 18:48:02 GMT"
affordable housing reaches milestone south shore chicago,construction news,"Tue, 13 May 2025 12:37:31 GMT"
suspected dui driver crashes spanaway hurting worker komo,construction news,"Tue, 13 May 2025 11:54:00 GMT"
celebrating cbc merit awards honor impact across built environment chicago,construction news,"Tue, 13 May 2025 12:26:07 GMT"
chicago becomes first major pass green social housing ordinance chicago,construction news,"Mon, 12 May 2025 12:31:17 GMT"
keeley build helukabel usa manufacturing expansion west dundee chicago,construction news,"Sun, 11 May 2025 12:26:43 GMT"
overnight closures several highways tacoma tribune,construction news,"Tue, 13 May 2025 17:00:00 GMT"
pbmc begins new neurosciences center riverhead review,construction news,"Tue, 13 May 2025 17:03:33 GMT"
homeland security announces dozens immigration arrets wildwood sites yahoo,construction news,"Tue, 13 May 2025 20:30:53 GMT"
worker dies injuries sustained newark site new jersey,construction news,"Sat, 10 May 2025 15:10:44 GMT"
hungary output falls softer pace tradingview,construction news,"Wed, 14 May 2025 06:49:00 GMT"
injured apartment fire northwest side cbs,construction news,"Tue, 13 May 2025 21:11:06 GMT"
borough roselle park announces upcoming projects tapinto,construction news,"Tue, 13 May 2025 20:58:00 GMT"
balfour beatty features discussing internal mobility energy sector balfour beatty,construction news,"Fri, 09 May 2025 10:52:07 GMT"
next sevier avenue like many knoxville mix knoxville sentinel,construction news,"Tue, 13 May 2025 09:08:32 GMT"
turnover continue alter downtown greenville daily reflector,construction news,"Tue, 13 May 2025 10:45:00 GMT"
captive audience zone draws food fair shoppers tullahoma,construction news,"Mon, 12 May 2025 02:00:00 GMT"
demolition cleanup begin meridian plaza apartment complex edwardsville intelligencer,construction news,"Tue, 13 May 2025 13:16:02 GMT"
georgia power begins bess,construction news,"Fri, 09 May 2025 10:45:58 GMT"
marvin premier,construction news,"Mon, 12 May 2025 10:40:30 GMT"
director lexington dies car crash lexington herald leader,construction news,"Tue, 13 May 2025 15:04:00 GMT"
people died sites kyrgyzstan akipress agency,construction news,"Wed, 14 May 2025 06:43:00 GMT"
contract awarded darlington smr world nuclear,construction news,"Fri, 09 May 2025 13:04:34 GMT"
lakeshore boulevard continue throughout summer,construction news,"Sat, 10 May 2025 05:48:45 GMT"
encouraged strong begins apartment tower raleigh costar,construction news,"Mon, 12 May 2025 20:44:05 GMT"
nominations open pillars real estate awards,construction news,"Wed, 14 May 2025 12:46:15 GMT"
mass pike drivers could see traffic delays weekend cbs,construction news,"Thu, 08 May 2025 21:02:00 GMT"
global signs lease relocate northern virginia office costar,construction news,"Fri, 09 May 2025 21:53:49 GMT"
body calls clarity immigration visa list,construction news,"Wed, 14 May 2025 11:44:05 GMT"
missouri house republicans surprise senate killing bill,construction news,"Mon, 12 May 2025 10:47:00 GMT"
flames smoke pour commercial downtown puyallup monday tacoma tribune,construction news,"Mon, 12 May 2025 23:45:00 GMT"
phoenix brickwork offers support rebuild school project doncaster premier,construction news,"Wed, 14 May 2025 12:45:17 GMT"
new pope elected lead catholic trench collapses worker l morning brief fox phoenix,construction news,"Thu, 08 May 2025 16:59:47 GMT"
begin highland avenue may madison daily leader,construction news,"Fri, 09 May 2025 19:00:00 GMT"
ottawa home builders promised charges reform cbc,construction news,"Wed, 14 May 2025 15:34:57 GMT"
judge slams caterpillar innacurate claim plant dumping case,construction news,"Wed, 14 May 2025 12:00:21 GMT"
people real estate nh nh review,construction news,"Wed, 30 Apr 2025 07:00:00 GMT"
aussie tradie cops angle grinder face,construction news,"Wed, 14 May 2025 14:38:32 GMT"
upcoming infrastructure pipeline nista tells mps,construction news,"Wed, 14 May 2025 10:14:24 GMT"
failure missouri budget bill shocks enrages state senate joplin globe,construction news,"Tue, 13 May 2025 14:00:00 GMT"
president trump calls obama presidential center blames cbs,construction news,"Tue, 06 May 2025 19:18:00 GMT"
many workers face mental health issues spectrum,construction news,"Tue, 06 May 2025 15:15:00 GMT"
people real estate nh nh review,construction news,"Wed, 23 Apr 2025 07:00:00 GMT"
see new tower cranes future ucsf parnassus heights uc san francisco,construction news,"Mon, 03 Mar 2025 08:00:00 GMT"
turner establishes vc arm dive,construction news,"Mon, 17 Mar 2025 07:00:00 GMT"
stepping career va,construction news,"Wed, 12 Feb 2025 08:00:00 GMT"
hill town deliver cambridgeshire resi scheme,construction news,"Wed, 14 May 2025 14:13:20 GMT"
fitout specialist errigal branches main contractor,construction news,"Wed, 14 May 2025 11:45:38 GMT"
trump budget would slash boost transportation projects enr,construction news,"Mon, 05 May 2025 07:00:00 GMT"
street march sioux falls,construction news,"Fri, 21 Mar 2025 07:00:00 GMT"
megaprojects fueling boom austin enr,construction news,"Mon, 07 Apr 2025 07:00:00 GMT"
munnelly names new chief executive founder becomes chairman,construction news,"Wed, 14 May 2025 13:39:42 GMT"
begins northern virginia science center,construction news,"Mon, 31 Mar 2025 07:00:00 GMT"
starts decrease december dodge network,construction news,"Thu, 23 Jan 2025 08:00:00 GMT"
cheer inland homes creditors,construction news,"Wed, 14 May 2025 11:53:45 GMT"
broad nj coalition calls major school program nj spotlight,construction news,"Mon, 17 Feb 2025 08:00:00 GMT"
profit rises altrad amid warning,construction news,"Wed, 14 May 2025 11:45:38 GMT"
begins new mountain biking trail foothills boise,construction news,"Thu, 03 Apr 2025 07:00:00 GMT"
purdue university breaks ground academic success indianapolis purdue university,construction news,"Thu, 03 Apr 2025 07:00:00 GMT"
us halts vast wind farm new york coast bbc,construction news,"Thu, 17 Apr 2025 07:00:00 GMT"
worker dies bixby osha investigating,construction news,"Tue, 01 Apr 2025 07:00:00 GMT"
billions many illinois university projects stalled capitol illinois,construction news,"Mon, 24 Mar 2025 07:00:00 GMT"
state street bridge closing emergency repairs chicago,construction news,"Mon, 14 Apr 2025 07:00:00 GMT"
weathers uncertainty enr,construction news,"Mon, 21 Apr 2025 07:00:00 GMT"
boise state begins new esi management boise state university,construction news,"Fri, 24 Jan 2025 08:00:00 GMT"
people real estate nh nh review,construction news,"Wed, 26 Feb 2025 08:00:00 GMT"
graham scoops xl industries dive,construction news,"Tue, 11 Mar 2025 07:00:00 GMT"
university houston pauses new amid regarding state funding houston public,construction news,"Tue, 11 Mar 2025 07:00:00 GMT"
first nation blocks bridge replacement project cbc,construction news,"Tue, 13 May 2025 02:26:00 GMT"
releases nonresidential spending rises highest level record february,construction news,"Tue, 01 Apr 2025 07:00:00 GMT"
underway solar projects sou,construction news,"Wed, 15 Jan 2025 08:00:00 GMT"
dodge momentum index grows december dodge network,construction news,"Wed, 08 Jan 2025 08:00:00 GMT"
chenango bread addition binghamton university,construction news,"Fri, 04 Apr 2025 07:00:00 GMT"
virginia tech gives master class capital enr,construction news,"Mon, 24 Mar 2025 07:00:00 GMT"
florida struggles affordable housing despite boom university florida,construction news,"Tue, 11 Feb 2025 08:00:00 GMT"
parkway impacts national park service,construction news,"Thu, 13 Mar 2025 07:00:00 GMT"
march clemson,construction news,"Mon, 17 Mar 2025 07:00:00 GMT"
starts increase october dodge network,construction news,"Thu, 21 Nov 2024 08:00:00 GMT"
beyond hard mental struggles become deadliest danger kff health,construction news,"Tue, 14 Jan 2025 08:00:00 GMT"
best specialty minnesota zoo treetop trail enr,construction news,"Thu, 13 Mar 2025 07:00:00 GMT"
modular interface standard aims establish clear guidelines enr,construction news,"Thu, 10 Apr 2025 07:00:00 GMT"
one person dead following accident bixby,construction news,"Mon, 31 Mar 2025 07:00:00 GMT"
new college blooms coachella valley school,construction news,"Thu, 06 Mar 2025 08:00:00 GMT"
american announces results fourth quarter ended december globenewswire,construction news,"Wed, 19 Mar 2025 07:00:00 GMT"
swiss chemicals maker sika looks stronger us earnings beat reuters,construction chemicals,"Fri, 21 Feb 2025 08:00:00 GMT"
chemicals global strategic globenewswire,construction chemicals,"Thu, 16 Jan 2025 08:00:00 GMT"
survey finds pros face costly delays coatings world,construction chemicals,"Mon, 21 Apr 2025 07:00:00 GMT"
sika expands asian presence chemanager,construction chemicals,"Mon, 28 Apr 2025 14:44:00 GMT"
completes acquisition leading player chemicals emerging strengthening worldwide presence sector,construction chemicals,"Mon, 10 Feb 2025 08:05:48 GMT"
finalizes fosroc acquisition deal enr,construction chemicals,"Fri, 14 Feb 2025 08:00:00 GMT"
chemicals set expand leader,construction chemicals,"Tue, 16 Jul 2024 07:00:00 GMT"
new eu rules safety sustainability mark new step competitiveness european commission,construction chemicals,"Tue, 07 Jan 2025 08:00:00 GMT"
deals shape future bain,construction chemicals,"Tue, 04 Feb 2025 08:00:00 GMT"
us optimism hit trump trade sika ceo reuters,construction chemicals,"Tue, 15 Apr 2025 07:00:00 GMT"
chemicals globenewswire,construction chemicals,"Mon, 14 Oct 2024 07:00:00 GMT"
thomas pci lean production initiative pci basf chemanager,construction chemicals,"Mon, 28 Apr 2025 11:39:45 GMT"
completes acquisition ovniver mexico central strengthening worldwide presence chemicals,construction chemicals,"Wed, 15 Jan 2025 08:00:00 GMT"
sika us sector unsettled trump trade policy reuters,construction chemicals,"Tue, 15 Apr 2025 07:00:00 GMT"
chemicals set significant expansion,construction chemicals,"Wed, 07 May 2025 07:32:00 GMT"
chemicals reach usd globenewswire,construction chemicals,"Fri, 11 Oct 2024 07:00:00 GMT"
chemical statistics,construction chemicals,"Wed, 07 May 2025 03:42:00 GMT"
chemicals reach usd globenewswire,construction chemicals,"Thu, 11 Jul 2024 07:00:00 GMT"
acquire chemicals ovniver european coatings,construction chemicals,"Wed, 21 Aug 2024 07:00:00 GMT"
bn chemicals globenewswire,construction chemicals,"Thu, 05 Sep 2024 07:00:00 GMT"
resilience global path forward chemicals mckinsey,construction chemicals,"Wed, 02 Apr 2025 07:00:00 GMT"
chemicals size,construction chemicals,"Fri, 14 Feb 2025 04:06:51 GMT"
chemical outlook deloitte,construction chemicals,"Mon, 04 Nov 2024 08:00:00 GMT"
sika acquires finishing usa european coatings,construction chemicals,"Wed, 05 Mar 2025 08:00:00 GMT"
sika us sector unsettled trump trade policy tradingview,construction chemicals,"Mon, 14 Apr 2025 07:00:00 GMT"
chemicals competitor,construction chemicals,"Mon, 10 Mar 2025 07:00:00 GMT"
intelligence chemical analytics pricing resourcewise,construction chemicals,"Mon, 05 May 2025 13:07:47 GMT"
industrial calcium byproduct sustainable applications acs publications,construction chemicals,"Thu, 09 Jan 2025 08:00:00 GMT"
masterfiber basf,construction chemicals,"Thu, 08 Aug 2024 07:38:51 GMT"
covestro mdi carlisle chemicals,construction chemicals,"Fri, 16 Aug 2024 07:00:00 GMT"
buys chemicals manufacturer fosroc global review,construction chemicals,"Wed, 12 Feb 2025 08:00:00 GMT"
basf sika revolutionize sustainable epoxy hardener chemanalyst,construction chemicals,"Tue, 18 Mar 2025 07:00:00 GMT"
chemical next big thing major giants dow henkel,construction chemicals,"Thu, 03 Apr 2025 07:00:00 GMT"
seals deal acquire ovniver chemanalyst,construction chemicals,"Tue, 20 Aug 2024 07:00:00 GMT"
buys mexican chemicals global review,construction chemicals,"Tue, 20 Aug 2024 07:00:00 GMT"
acquires major chemicals player briefing,construction chemicals,"Thu, 27 Jun 2024 07:00:00 GMT"
nippon shokubai purchases emulsion assets jsr corp chemanalyst,construction chemicals,"Fri, 15 Nov 2024 08:00:00 GMT"
chemicals size hit usd bn precedence,construction chemicals,"Mon, 07 Apr 2025 07:00:00 GMT"
acquires chemicals kilwaughter wave,construction chemicals,"Thu, 05 Dec 2024 08:00:00 GMT"
top companies specializing waterproofing spherical,construction chemicals,"Tue, 11 Feb 2025 19:28:10 GMT"
cma chemicals investigation dropped,construction chemicals,"Fri, 24 Jan 2025 08:00:00 GMT"
acquires chemicals fosroc zawya,construction chemicals,"Mon, 10 Feb 2025 08:00:00 GMT"
chemical projected usd fmiblog,construction chemicals,"Mon, 21 Apr 2025 07:00:00 GMT"
top sustainable companies digital,construction chemicals,"Wed, 25 Sep 2024 07:00:00 GMT"
acquire mexican chemicals player ovniver indian chemical,construction chemicals,"Mon, 19 Aug 2024 02:40:06 GMT"
master builders sets new benchmark workability pcc masteremaco basf,construction chemicals,"Sun, 22 Sep 2024 04:43:01 GMT"
thermax joins hands ocq manufacturing chemicals standard,construction chemicals,"Tue, 11 Mar 2025 07:00:00 GMT"
press release distribution pr platform access newswire,construction chemicals,"Wed, 28 Aug 2024 07:00:00 GMT"
amit kothari role advanced chemical online,construction chemicals,"Mon, 03 Feb 2025 08:00:00 GMT"
pfas reduced highway maintenance projects,construction chemicals,"Wed, 26 Jun 2024 07:00:00 GMT"
sika takes us hps completely blue bluewin,construction chemicals,"Tue, 04 Mar 2025 08:00:00 GMT"
thermax expands chemicals buildtech acquisition machine maker,construction chemicals,"Sat, 26 Oct 2024 07:00:00 GMT"
epoxy putty chemicals key trends,construction chemicals,"Tue, 06 Aug 2024 07:00:00 GMT"
cma shelves chemicals probe cuts staff,construction chemicals,"Fri, 24 Jan 2025 08:00:00 GMT"
top pidilite alternatives competitors,construction chemicals,"Wed, 27 Nov 2024 08:00:00 GMT"
saint gobain acquires chemicals,construction chemicals,"Wed, 04 Dec 2024 08:00:00 GMT"
president ilham aliyev inaugurates several facilities sumgayit chemical industrial park,construction chemicals,"Wed, 30 Apr 2025 10:29:00 GMT"
chemical cartel case also dropped competition watchdog roofing,construction chemicals,"Thu, 23 Jan 2025 08:00:00 GMT"
master builders bets edge take indian giants chemicals sector,construction chemicals,"Fri, 24 Jan 2025 08:00:00 GMT"
completes acquisition bailey companies wire,construction chemicals,"Mon, 03 Jun 2024 07:00:00 GMT"
chemicals mbs eyes rs crore turnover standard,construction chemicals,"Thu, 23 Jan 2025 08:00:00 GMT"
sika acquires chemicals vinaldom dominican republic indian chemical,construction chemicals,"Sat, 03 Aug 2024 05:00:05 GMT"
rise indian specialty chemicals overview last five,construction chemicals,"Tue, 05 Nov 2024 05:41:30 GMT"
armorsil west cements leadership chemicals prestigious award nigeria,construction chemicals,"Mon, 17 Mar 2025 07:00:00 GMT"
vura sourav ganguly join forces transform chemicals quint,construction chemicals,"Mon, 24 Feb 2025 08:00:00 GMT"
cepsa begins first chemical plant spain produce base hydroalcoholic gels,construction chemicals,"Fri, 07 Jun 2024 07:00:00 GMT"
agrees acquire fosroc world network,construction chemicals,"Fri, 28 Jun 2024 07:00:00 GMT"
master builders expands strengthening presence chemicals sector machine maker,construction chemicals,"Mon, 27 Jan 2025 08:00:00 GMT"
lotte chemical pushing valued ,construction chemicals,"Tue, 03 Dec 2024 08:00:00 GMT"
antitrust investigations chemicals gates,construction chemicals,"Mon, 18 Dec 2023 08:00:00 GMT"
mark volmer appointed new head basf chemicals pacific,construction chemicals,"Fri, 07 Feb 2025 23:29:26 GMT"
completes fosroc acquisition index,construction chemicals,"Mon, 10 Feb 2025 08:00:00 GMT"
acquires boosting global reach manufacturing,construction chemicals,"Wed, 12 Feb 2025 08:00:00 GMT"
chemicals concern screening,construction chemicals,"Tue, 15 Feb 2022 08:00:00 GMT"
