cleaned_title,keyword,published
griffon industrial conglomerate stock greater tradingview,construction materials,"Wed, 14 May 2025 14:24:00 GMT"
construmat showcases transformation towards sustainability yahoo finance,construction materials,"Wed, 14 May 2025 08:00:00 GMT"
tantimber announce partnership deliver sustainable wood superior aesthetic technical quality azom,construction materials,"Wed, 14 May 2025 11:15:00 GMT"
debris turns gold axios,construction materials,"Mon, 12 May 2025 11:20:50 GMT"
resilience makes case california rebuilds wildfires wire,construction materials,"Mon, 12 May 2025 22:25:00 GMT"
moon mars exploration nasa,construction materials,"Tue, 13 May 2025 15:48:22 GMT"
supplier celebrates new,construction materials,"Tue, 13 May 2025 07:15:00 GMT"
municipal intelligence,construction materials,"Wed, 14 May 2025 04:29:24 GMT"
recycled concrete aggregates straits,construction materials,"Tue, 13 May 2025 06:06:59 GMT"
teamwork durable aluminium honeycomb panels cision,construction materials,"Wed, 14 May 2025 11:31:00 GMT"
paver blocks share,construction materials,"Wed, 14 May 2025 04:23:06 GMT"
captures cybertruck driver dumping oakland street cbs,construction materials,"Sun, 11 May 2025 01:08:00 GMT"
sustainable alternatives traditional networks,construction materials,"Sat, 10 May 2025 11:08:35 GMT"
doman announces first quarter financial results globenewswire,construction materials,"Thu, 08 May 2025 20:01:58 GMT"
rebuilding chains turner townsend,construction materials,"Mon, 12 May 2025 07:00:00 GMT"
james hardie signs agreement davidson homes,construction materials,"Wed, 14 May 2025 16:07:18 GMT"
finally know ancient roman concrete lasts thousands sciencealert,construction materials,"Tue, 13 May 2025 12:03:53 GMT"
engineers make groundbreaking discovery could revolutionize cool,construction materials,"Mon, 12 May 2025 09:00:00 GMT"
decarbonise carbon capture testbeds et infra,construction materials,"Wed, 14 May 2025 13:54:11 GMT"
home stocks builders firstsource yahoo finance,construction materials,"Tue, 13 May 2025 03:32:00 GMT"
man charged allegedly illegally dumping brownsville krgv,construction materials,"Fri, 09 May 2025 23:58:14 GMT"
inventwood touts lumber tomorrow hbs dealer,construction materials,"Mon, 12 May 2025 16:21:21 GMT"
oakland residents outraged illegal dumping tesla cybertruck driver cbs,construction materials,"Sun, 11 May 2025 02:34:04 GMT"
maker breaks texas site buda journals,construction materials,"Fri, 09 May 2025 18:41:00 GMT"
startup turning seafood shell waste furniture boston globe,construction materials,"Mon, 12 May 2025 10:02:39 GMT"
costs rise third month tariff pressures dive,construction materials,"Mon, 14 Apr 2025 07:00:00 GMT"
risk tariffs dive,construction materials,"Tue, 25 Mar 2025 07:00:00 GMT"
new york metro gains access tons pros,construction materials,"Tue, 13 May 2025 16:03:07 GMT"
engineers build wind turbine one saw difficult cool,construction materials,"Sun, 11 May 2025 10:45:27 GMT"
doubles electrolyte rechargeable battery chemistry world,construction materials,"Thu, 08 May 2025 14:01:39 GMT"
millions revolutionary bricks produced recycled waste achieving certification bdc magazine,construction materials,"Wed, 14 May 2025 07:21:32 GMT"
millions recycled bricks set enter production following certification sustainable times,construction materials,"Wed, 14 May 2025 06:34:57 GMT"
diamond public limited earnings results first quarter ended march,construction materials,"Wed, 14 May 2025 07:49:00 GMT"
bmc plans convert plastic waste times,construction materials,"Tue, 13 May 2025 17:37:00 GMT"
martin marietta posts higher profit strong reuters,construction materials,"Wed, 30 Apr 2025 07:00:00 GMT"
sterling announces mass timber shaft wall system globenewswire,construction materials,"Tue, 13 May 2025 13:06:01 GMT"
webinar unlock billions dollars clean rmi,construction materials,"Wed, 23 Apr 2025 00:56:30 GMT"
production pace rolling lines maintained pig iron collides smm shanghai metals,construction materials,"Tue, 13 May 2025 05:51:47 GMT"
optimizing museum selection mass spectrometry nature,construction materials,"Tue, 06 May 2025 07:00:00 GMT"
investors consider retaining carlisle stock tradingview,construction materials,"Mon, 12 May 2025 11:31:00 GMT"
harnessing carbon removal opportunities biomass residue rmi,construction materials,"Mon, 05 May 2025 12:22:30 GMT"
proposed tax credit aimed boosting minnesota homebuilding minnesota house representatives,construction materials,"Tue, 25 Feb 2025 08:00:00 GMT"
sweeping new tariffs put future projects risk dive,construction materials,"Thu, 03 Apr 2025 07:00:00 GMT"
field raises ai platform,construction materials,"Wed, 30 Apr 2025 07:00:00 GMT"
sustainable globenewswire,construction materials,"Thu, 01 May 2025 16:07:35 GMT"
import residential eye housing,construction materials,"Fri, 13 Dec 2024 08:00:00 GMT"
releases increase steel surges nearly february,construction materials,"Thu, 13 Mar 2025 14:09:58 GMT"
colorado economists warn rising home job losses tariffs hit,construction materials,"Mon, 21 Apr 2025 07:00:00 GMT"
foundation acquires rew modern distribution management,construction materials,"Tue, 22 Apr 2025 14:12:26 GMT"
rising kyrgyzstan slow economic times central,construction materials,"Tue, 13 May 2025 13:15:33 GMT"
could store tonnes annually science aaas,construction materials,"Thu, 09 Jan 2025 08:00:00 GMT"
foundation acquires rew industrial distribution,construction materials,"Tue, 22 Apr 2025 21:40:31 GMT"
coromandel sakarni plaster form jv produce green hindu,construction materials,"Wed, 14 May 2025 14:44:00 GMT"
spilka proposes lifting sales tax boost housing boston globe,construction materials,"Thu, 08 May 2025 06:00:00 GMT"
releases increase since february,construction materials,"Thu, 13 Feb 2025 15:09:17 GMT"
carlisle earnings sales yahoo finance,construction materials,"Thu, 24 Apr 2025 07:00:00 GMT"
epa decimates grant program aimed measuring reducing emissions inside climate,construction materials,"Mon, 24 Mar 2025 07:00:00 GMT"
firms incorporate traditional japanese craft techniques local government support,construction materials,"Sun, 11 May 2025 07:20:00 GMT"
important tariffs impact arentfox schiff,construction materials,"Fri, 04 Apr 2025 07:00:00 GMT"
sustainable bamboo emerges star sustainable builders seek alternatives yahoo finance,construction materials,"Thu, 01 May 2025 07:00:00 GMT"
vulnerable tariffs yahoo finance,construction materials,"Fri, 25 Apr 2025 07:00:00 GMT"
chain exploring digital tools transforming procurement,construction materials,"Tue, 13 May 2025 06:34:27 GMT"
paying clean rmi,construction materials,"Tue, 25 Feb 2025 08:00:00 GMT"
homebuilders warn rising costs tariffs target key canada kpic,construction materials,"Thu, 08 May 2025 23:52:01 GMT"
tariffs put pressure wftv,construction materials,"Sun, 23 Mar 2025 07:00:00 GMT"
resilience makes case california rebuilds wildfires joplin globe,construction materials,"Mon, 12 May 2025 22:24:31 GMT"
inventwood wood stronger steel techcrunch,construction materials,"Mon, 12 May 2025 14:00:00 GMT"
uncertainty reigns tariffs approaches national home builders nahb,construction materials,"Tue, 01 Apr 2025 07:00:00 GMT"
coromandel sakarni forge green joint venture chemical digest,construction materials,"Wed, 14 May 2025 12:35:06 GMT"
home stocks benchmarking trex yahoo finance,construction materials,"Fri, 18 Apr 2025 07:00:00 GMT"
home catches fire pittsburgh wtae,construction materials,"Sun, 27 Apr 2025 07:00:00 GMT"
safety sheets finds inaccuracies nanoparticle content magazine,construction materials,"Fri, 18 Apr 2025 07:00:00 GMT"
collaborative pratt institute,construction materials,"Thu, 24 Apr 2025 06:29:50 GMT"
professor julee innovations guide future green cu denver,construction materials,"Tue, 04 Mar 2025 08:00:00 GMT"
sustainable polymeric sand revolu northeast channel nebraska,construction materials,"Mon, 05 May 2025 16:46:00 GMT"
seawater networks,construction materials,"Fri, 21 Mar 2025 07:00:00 GMT"
lumber lead higher march yield pro,construction materials,"Fri, 11 Apr 2025 07:00:00 GMT"
new could make concrete sustainable northwestern university,construction materials,"Wed, 19 Mar 2025 07:00:00 GMT"
looking way try star tribune,construction materials,"Tue, 06 May 2025 07:00:00 GMT"
concrete fiber set surge amid increasing durable sustainable whatech,construction materials,"Tue, 13 May 2025 10:21:35 GMT"
covid contractors still wait come dive,construction materials,"Tue, 11 Mar 2025 07:00:00 GMT"
tariffs drive rapid increase march archinect,construction materials,"Fri, 11 Apr 2025 07:00:00 GMT"
scientists think billions tons carbon dioxide stored popular mechanics,construction materials,"Tue, 14 Jan 2025 08:00:00 GMT"
continue grow slower pace eye housing,construction materials,"Fri, 11 Apr 2025 07:00:00 GMT"
tariff implications wells fargo mile high cre,construction materials,"Wed, 09 Apr 2025 07:00:00 GMT"
homebuilders ask trump tariff exemptions,construction materials,"Sat, 01 Feb 2025 08:00:00 GMT"
releases inch,construction materials,"Tue, 14 Jan 2025 15:06:08 GMT"
gfrp rebars set robust key future prospects new whatech,construction materials,"Tue, 13 May 2025 02:53:18 GMT"
northern lack tradespeople challenge nunavut,construction materials,"Tue, 13 May 2025 20:02:01 GMT"
untapped could store billions tons annually tech xplore,construction materials,"Thu, 09 Jan 2025 08:00:00 GMT"
rose bls enr,construction materials,"Thu, 13 Feb 2025 08:00:00 GMT"
rise bulk transporter,construction materials,"Fri, 21 Mar 2025 07:00:00 GMT"
surge buliding hits coimbatore times,construction materials,"Sun, 11 May 2025 19:17:00 GMT"
february economist outlook costs urban land magazine,construction materials,"Wed, 19 Feb 2025 08:00:00 GMT"
governor newsom signs executive order help los angeles rebuild faster stronger governor california,construction materials,"Sun, 12 Jan 2025 08:00:00 GMT"
tariffs drive surge march abc demolition recycling,construction materials,"Mon, 14 Apr 2025 07:00:00 GMT"
ron four decade veteran carlisle retires roofing contractor magazine,construction materials,"Mon, 17 Feb 2025 08:00:00 GMT"
new tariffs add pressure pipeline dive,construction materials,"Tue, 04 Mar 2025 08:00:00 GMT"
acoustic insulation key,construction materials,"Mon, 12 May 2025 08:13:00 GMT"
tariff concerns loom input dive,construction materials,"Thu, 14 Nov 2024 08:00:00 GMT"
new ulm police investigating spilled ingstad,building materials,"Wed, 14 May 2025 14:49:07 GMT"
new plant decontaminates waste reuse,building materials,"Wed, 14 May 2025 16:06:27 GMT"
james hardie announces expanded product gurufocus,building materials,"Wed, 14 May 2025 13:40:04 GMT"
montana state looks fungi could help create explore big sky,building materials,"Mon, 12 May 2025 20:11:35 GMT"
trump tariffs add thousands new home costs msn,building materials,"Wed, 14 May 2025 14:49:35 GMT"
resilience makes case california rebuilds wildfires yahoo finance,building materials,"Mon, 12 May 2025 22:25:00 GMT"
offer deep discounts appliances owensboro times,building materials,"Fri, 09 May 2025 05:21:42 GMT"
rising green trends propel insulation toward,building materials,"Wed, 14 May 2025 14:40:52 GMT"
shop tilebar planning showroom former short pump richmond bizsense,building materials,"Thu, 24 Apr 2025 07:00:00 GMT"
james hardie announces expanded product gurufocus,building materials,"Wed, 14 May 2025 14:44:03 GMT"
doman announces meeting results election directors globenewswire,building materials,"Fri, 09 May 2025 12:03:20 GMT"
james hardie secures exclusive deal davidson homes gurufocus,building materials,"Wed, 14 May 2025 14:32:38 GMT"
new home builds provide price relief amid tariff concerns mpa mag,building materials,"Tue, 13 May 2025 14:30:00 GMT"
bipartisan bill boost green glides house canary,building materials,"Thu, 03 Apr 2025 07:00:00 GMT"
cincinnati nonprofit keeps offers items half price wcpo cincinnati,building materials,"Wed, 07 May 2025 21:28:20 GMT"
get tariffs affect groceries ahead hurricane season wpbf,building materials,"Wed, 07 May 2025 21:10:00 GMT"
kodiak elevates two presidents hbs dealer,building materials,"Fri, 09 May 2025 18:59:50 GMT"
good bad lumber production tariffs national home builders nahb,building materials,"Tue, 08 Apr 2025 07:00:00 GMT"
mission zero launches first demo plant carbon herald,building materials,"Mon, 05 May 2025 10:45:22 GMT"
softwood lumber continue lead price eye housing,building materials,"Thu, 13 Mar 2025 07:00:00 GMT"
nyc borough plans mass timber housing units woodworking network,building materials,"Tue, 13 May 2025 14:03:13 GMT"
new partnership york revolution crdc seeks eliminate plastic waste york daily record,building materials,"Fri, 18 Apr 2025 07:00:00 GMT"
hierarchical low nature,building materials,"Fri, 28 Mar 2025 07:00:00 GMT"
develop sustainable tech xplore,building materials,"Tue, 06 May 2025 07:00:00 GMT"
accent announces key promotions lbm,building materials,"Wed, 07 May 2025 14:39:09 GMT"
sustainable globenewswire,building materials,"Thu, 01 May 2025 16:07:35 GMT"
giant unveils removing concrete quantum commodity intelligence,building materials,"Mon, 12 May 2025 06:44:54 GMT"
new river acquired colorado watauga democrat,building materials,"Mon, 21 Apr 2025 23:38:41 GMT"
manufacturing inspired creates strong usc,building materials,"Tue, 15 Apr 2025 07:00:00 GMT"
recycled bricks green future,building materials,"Wed, 14 May 2025 09:07:43 GMT"
homebuilders warn rising costs tariffs target key canada katu,building materials,"Thu, 08 May 2025 23:52:01 GMT"
green undercut eu plastic goals science aaas,building materials,"Thu, 09 Jan 2025 08:00:00 GMT"
trump rescinds federal program boost canary,building materials,"Thu, 23 Jan 2025 08:00:00 GMT"
sales amid growing economic headwinds,building materials,"Sat, 10 May 2025 18:38:00 GMT"
effects uv degradation emphasis microplastic generation potential,building materials,"Wed, 05 Feb 2025 08:00:00 GMT"
announces expansion bringing jobs,building materials,"Thu, 17 Apr 2025 07:00:00 GMT"
national institute standards,building materials,"Mon, 17 Mar 2025 07:00:00 GMT"
nazi found argentine main courthouse mercopress,building materials,"Mon, 12 May 2025 19:51:00 GMT"
bank first instinct tariffs hike fortune,building materials,"Wed, 12 Mar 2025 07:00:00 GMT"
doman financial results globenewswire,building materials,"Thu, 27 Feb 2025 08:00:00 GMT"
provider plans expansion chaska finance commerce,building materials,"Mon, 17 Mar 2025 07:00:00 GMT"
home builders navigate tariffs,building materials,"Fri, 04 Apr 2025 07:00:00 GMT"
vulcan receives price target boost morgan gurufocus,building materials,"Mon, 12 May 2025 12:56:34 GMT"
shellf life transforms shellfish scraps restaurants brown daily herald,building materials,"Mon, 10 Mar 2025 07:00:00 GMT"
new recycling facility turn beverage cartons recycling,building materials,"Wed, 29 Jan 2025 08:00:00 GMT"
new american harvest rmi,building materials,"Thu, 10 Apr 2025 20:08:15 GMT"
fungi bacteria could pave way structures smithsonian magazine,building materials,"Thu, 24 Apr 2025 07:00:00 GMT"
los angeles wildfires spark interest natural reuters,building materials,"Wed, 22 Jan 2025 08:00:00 GMT"
doman shareholders earned last five yahoo finance,building materials,"Wed, 09 Apr 2025 07:00:00 GMT"
pricier could drive home costs nbc,building materials,"Mon, 21 Apr 2025 07:00:00 GMT"
tariffs could impact costs nbc boston,building materials,"Wed, 12 Feb 2025 08:00:00 GMT"
cook boardman acquires pr newswire,building materials,"Tue, 18 Mar 2025 07:00:00 GMT"
kodiak acquires nc dealer new river digest,building materials,"Tue, 15 Apr 2025 07:00:00 GMT"
opening early rmi,building materials,"Sun, 17 Nov 2024 01:26:34 GMT"
ponderosa opens idaho spokane,building materials,"Thu, 10 Apr 2025 07:00:00 GMT"
producer crh forecasts profit jump reuters,building materials,"Wed, 26 Feb 2025 08:00:00 GMT"
creates stronger network,building materials,"Mon, 24 Mar 2025 07:00:00 GMT"
dealer groups raise tariff lumber coalition shows support woodworking network,building materials,"Tue, 25 Mar 2025 07:00:00 GMT"
james hardie azek combine creating leading platform wire,building materials,"Sun, 23 Mar 2025 07:00:00 GMT"
emission characteristics vocs,building materials,"Thu, 05 Dec 2024 08:00:00 GMT"
big reinventing century techbuzz,building materials,"Wed, 16 Apr 2025 23:25:27 GMT"
turning house home seiffert supplies ourquadcities,building supplies,"Fri, 09 May 2025 17:00:00 GMT"
revenues rise supplies amidst subdued markets,building supplies,"Wed, 14 May 2025 06:44:09 GMT"
large supplies depot shuts potential job losses msn,building supplies,"Fri, 09 May 2025 07:21:44 GMT"
us lumber thrive break nc state university,building supplies,"Mon, 06 Jan 2025 08:00:00 GMT"
kent supplies constructs modern retail experiences dynamics microsoft,building supplies,"Mon, 10 Feb 2025 08:00:00 GMT"
ad supplies canada signs ontario member,building supplies,"Tue, 13 May 2025 12:23:55 GMT"
local set open new showroom oneida county wktv,building supplies,"Wed, 02 Apr 2025 02:09:05 GMT"
builders stockpile swap work tariffs wsj,building supplies,"Tue, 11 Mar 2025 07:00:00 GMT"
california wildfires affecting chains chain dive,building supplies,"Tue, 28 Jan 2025 08:00:00 GMT"
increase november led lumber eye housing,building supplies,"Thu, 12 Dec 2024 08:00:00 GMT"
us lbm acquires manning supplies florida modern distribution management,building supplies,"Mon, 11 Nov 2024 23:02:58 GMT"
washington builders brace impact tariffs home supplies komo,building supplies,"Fri, 28 Feb 2025 08:00:00 GMT"
hurricane impact could felt sectors marketwatch,building supplies,"Wed, 09 Oct 2024 07:00:00 GMT"
soaring impact housing national home builders nahb,building supplies,"Fri, 26 Jul 2024 07:00:00 GMT"
tariffs imported give roofing jitters roofing contractor magazine,building supplies,"Fri, 04 Apr 2025 07:00:00 GMT"
bank first instinct tariffs hike yahoo finance,building supplies,"Wed, 12 Mar 2025 07:00:00 GMT"
supplies looks rebrand sheridan press,building supplies,"Tue, 17 Dec 2024 08:00:00 GMT"
gms buy yvon modern distribution management,building supplies,"Mon, 11 Nov 2024 23:50:24 GMT"
brad qxo first beacon oks yahoo finance,building supplies,"Thu, 20 Mar 2025 07:00:00 GMT"
distributor qxo launches hostile bid beacon wsj,building supplies,"Mon, 27 Jan 2025 08:00:00 GMT"
another massive deal james hardie offers azek world,building supplies,"Mon, 24 Mar 2025 07:00:00 GMT"
exclusive distributor qxo makes bid beacon roofing wsj,building supplies,"Mon, 18 Nov 2024 08:00:00 GMT"
tariffs affect,building supplies,"Tue, 28 Jan 2025 08:00:00 GMT"
qxo extends hostile bid beacon builder magazine,building supplies,"Tue, 25 Feb 2025 13:56:28 GMT"
builders proposed tariffs mexico could drive housing costs higher,building supplies,"Thu, 06 Feb 2025 08:00:00 GMT"
beacon roofing agrees qxo ending takeover battle reuters,building supplies,"Thu, 20 Mar 2025 07:00:00 GMT"
trump grants tariff delay mexican,building supplies,"Thu, 06 Mar 2025 08:00:00 GMT"
strike could lead delays dive,building supplies,"Tue, 01 Oct 2024 07:00:00 GMT"
australian price outlook altus,building supplies,"Tue, 25 Feb 2025 08:00:00 GMT"
beacon roofing qxo hopes roofing contractor magazine,building supplies,"Tue, 19 Nov 2024 08:00:00 GMT"
tariffs affect new homes renovations wcpo cincinnati,building supplies,"Tue, 18 Mar 2025 07:00:00 GMT"
pullman announces plans close store november daily,building supplies,"Thu, 03 Oct 2024 19:55:48 GMT"
qxo reportedly offers buy beacon roofing digital commerce,building supplies,"Tue, 19 Nov 2024 08:00:00 GMT"
disney dreamlight advanced marketing quest walkthrough thegamer,building supplies,"Wed, 12 Mar 2025 07:00:00 GMT"
tariff concerns loom pricing chain dive,building supplies,"Thu, 21 Nov 2024 08:00:00 GMT"
wausau distributing deckorators digest,building supplies,"Thu, 20 Feb 2025 08:00:00 GMT"
beacon announces acquisition passaic metal supplies,building supplies,"Wed, 30 Apr 2025 05:08:10 GMT"
builders firstsource acquires cluss lumber supplies woodworking network,building supplies,"Thu, 13 Feb 2025 08:00:00 GMT"
tariffs impact additional tariffs lumber wtvg,building supplies,"Fri, 07 Mar 2025 08:00:00 GMT"
bain,building supplies,"Thu, 20 Feb 2025 18:59:44 GMT"
federal judge us sell border wall enr,building supplies,"Mon, 30 Dec 2024 08:00:00 GMT"
former gates foundation leader lands engineered bamboo startup geekwire,building supplies,"Mon, 04 Nov 2024 08:00:00 GMT"
cumberland llc metal roofing pa lancaster farming,building supplies,"Tue, 10 Dec 2024 08:00:00 GMT"
srs distribution acquires marsh modern distribution management,building supplies,"Tue, 12 Nov 2024 04:23:15 GMT"
gillman best acquires goecker supplies inside indiana,building supplies,"Wed, 03 Jul 2024 07:00:00 GMT"
trump tariffs would result homebuilder price increases,building supplies,"Fri, 08 Nov 2024 08:00:00 GMT"
reciprocal tariffs mean home builders builder magazine,building supplies,"Wed, 02 Apr 2025 07:00:00 GMT"
border wall put san antonio,building supplies,"Sat, 21 Dec 2024 08:00:00 GMT"
tariffs lumber would hit home builders buyers axios,building supplies,"Sat, 01 Mar 2025 08:00:00 GMT"
foundation adds distributors hawaii modern distribution management,building supplies,"Tue, 12 Nov 2024 05:58:04 GMT"
jonesborough nonprofit helps supplies hurricane helene relief wbir,building supplies,"Sat, 22 Mar 2025 07:00:00 GMT"
tariffs imported spark concerns roofing contractor magazine,building supplies,"Fri, 04 Apr 2025 14:30:00 GMT"
hope mainstay since ready winter needs swark,building supplies,"Fri, 29 Nov 2024 08:00:00 GMT"
bfs acquires cluss lumber hbs dealer,building supplies,"Tue, 04 Feb 2025 08:00:00 GMT"
much lumber southern california need rebuild wildfires marketwatch,building supplies,"Thu, 16 Jan 2025 08:00:00 GMT"
foundation acquires unified door hardware nj modern distribution management,building supplies,"Tue, 12 Nov 2024 05:21:43 GMT"
tariffs could raise new much could buyers cnbc,building supplies,"Wed, 05 Mar 2025 08:00:00 GMT"
dockworkers strike impact enr,building supplies,"Tue, 01 Oct 2024 07:00:00 GMT"
beacon announces acquisition passaic metal supplies wire,building supplies,"Fri, 02 Aug 2024 07:00:00 GMT"
texas bought border wall federal austin,building supplies,"Sat, 28 Dec 2024 08:00:00 GMT"
builders warn trump tariffs raise home reno gazette,building supplies,"Wed, 02 Apr 2025 07:00:00 GMT"
center acquires contractors modern distribution management,building supplies,"Tue, 12 Nov 2024 05:05:00 GMT"
new home costs set rise increase mpa mag,building supplies,"Tue, 25 Mar 2025 07:00:00 GMT"
tariff impact reaches residential,building supplies,"Fri, 04 Apr 2025 07:00:00 GMT"
stocks benefiting surge stocknews,building supplies,"Sat, 04 Jan 2025 08:00:00 GMT"
trump tariffs could disrupt projects dive,building supplies,"Mon, 16 Dec 2024 08:00:00 GMT"
vulcan acquire leading southern california pr newswire,building supplies,"Wed, 11 Dec 2024 08:00:00 GMT"
trump fixing housing crisis may mean depending canadian wood cnn,building supplies,"Sun, 02 Feb 2025 08:00:00 GMT"
tools supplies stolen school site wkdz,building supplies,"Mon, 24 Feb 2025 08:00:00 GMT"
could rise due tariffs fox,building supplies,"Fri, 07 Feb 2025 08:00:00 GMT"
microsoft builds first datacenters wood slash carbon emissions microsoft,building supplies,"Thu, 31 Oct 2024 07:00:00 GMT"
diy secondhand surplus stores lancaster county find furniture lancasteronline,building supplies,"Thu, 07 Nov 2024 08:00:00 GMT"
tariffs lumber appliances set stage higher costs new homes remodeling projects ap,building supplies,"Mon, 17 Mar 2025 07:00:00 GMT"
goecker supplies acquired gillman best hbs dealer,building supplies,"Thu, 11 Jul 2024 07:00:00 GMT"
nc home lumber suppliers brace impact tariffs mexico cbs,building supplies,"Wed, 05 Mar 2025 08:00:00 GMT"
qxo transfer nasdaq eyes leadership stock titan,building supplies,"Mon, 06 Jan 2025 08:00:00 GMT"
contractors brace aluminum tariff impacts dive,building supplies,"Tue, 18 Feb 2025 08:00:00 GMT"
tariffs could play significant role already shaky housing fox,building supplies,"Thu, 06 Mar 2025 08:00:00 GMT"
us lbm rebrands texas locations texas digest,building supplies,"Mon, 15 Jul 2024 07:00:00 GMT"
large supplies depot shuts potential job losses,building supplies,"Fri, 09 May 2025 07:01:00 GMT"
wildfires tariffs california faces double threat crude oil,building supplies,"Sat, 11 Jan 2025 08:00:00 GMT"
abc acquires american modern distribution management,building supplies,"Tue, 06 Aug 2024 07:00:00 GMT"
larrabees star monthly,building supplies,"Tue, 31 Dec 2024 08:00:00 GMT"
gillman acquires goecker supplies republic,building supplies,"Sat, 06 Jul 2024 07:00:00 GMT"
pullman going doors late november big,building supplies,"Fri, 19 Jul 2024 17:38:11 GMT"
rgb supplies closes plymouth depot merchants,building supplies,"Mon, 12 May 2025 08:44:35 GMT"
doman announces second quarter financial results globenewswire,building supplies,"Fri, 09 Aug 2024 07:00:00 GMT"
triple lp dominated excellence awards stock titan,building supplies,"Thu, 20 Feb 2025 08:00:00 GMT"
gillman best home centers acquires goecker supplies lbm,building supplies,"Mon, 01 Jul 2024 07:00:00 GMT"
exclusive qxo brings roofing roofing contractor magazine,building supplies,"Thu, 21 Nov 2024 08:00:00 GMT"
worth supplies stolen pennsylvania burglary,building supplies,"Thu, 10 Apr 2025 07:00:00 GMT"
beacon announces acquisition passaic metal supplies stock titan,building supplies,"Fri, 02 Aug 2024 07:00:00 GMT"
lumber renovating home,building supplies,"Mon, 01 Jul 2024 07:00:00 GMT"
modular size reach grand view pr newswire,construction market,"Wed, 14 May 2025 15:30:00 GMT"
nordic center outlook globenewswire,construction market,"Wed, 14 May 2025 12:11:45 GMT"
