Fetched Time,Keyword,Title,Link
2025-05-10 01:18:47,sustainable construction materials,USU Engineer Pioneers Sustainable Construction Techniques Using Microbial Materials,https://www.usu.edu/today/story/usu-engineer-pioneers-sustainable-construction-techniques-using-microbial-materials
2025-05-10 01:18:47,sustainable construction materials,The role of sustainable energy in construction,https://www.innovationnewsnetwork.com/the-role-of-sustainable-energy-in-construction/52968/
2025-05-10 01:18:47,sustainable construction materials,Enhancing Sustainability in Construction Materials Through Innovative Practices,https://www.intelligentliving.co/sustainability-construction-materials/
2025-05-10 01:18:47,sustainable construction materials,BRE: A Call to Action for Sustainable Construction,https://sustainabilitymag.com/articles/bre-chief-calls-for-construction-industry-action-on-net-zero
2025-05-10 01:18:47,sustainable construction materials,Construction material industry's revenue to reach 47 billion USD,https://en.vietnamplus.vn/construction-material-industrys-revenue-to-reach-47-billion-usd-post303923.vnp
2025-05-10 01:18:47,sustainable construction materials,Sustainable Engineering Practices in Cons truction: A Systematic Revie w of,https://www.researchgate.net/publication/385681813_Sustainable_Engineering_Practices_in_Construction_A_Systematic_Review_of_Green_Building_Materials_and_Techniques
2025-05-10 01:18:47,sustainable construction materials,Building material reuse: An optimization framework for sourcing new and reclaimed building materials,https://www.sciencedirect.com/science/article/pii/S0959652624033419
2025-05-10 01:18:47,sustainable construction materials,"Sustainable Construction Materials Market Size, 2034 Report",https://www.gminsights.com/industry-analysis/sustainable-construction-materials-market
2025-05-10 01:18:47,sustainable construction materials,Sustainable construction could be lifeline for struggling Luxembourg builders,https://www.luxtimes.lu/businessandfinance/sustainable-construction-could-be-lifeline-for-struggling-luxembourg-builders/25835856.html
2025-05-10 01:18:47,sustainable construction materials,"Saudi Build Exhibition Day Three: Visions for a Smarter, More Sustainable Construction Sector",https://spa.gov.sa/en/N2202556
2025-05-10 01:18:47,sustainable construction materials,ofrice husk ash asaneco‑friendly substitute incement production,https://www.researchgate.net/publication/385681565_Innovative_approaches_to_sustainable_construction_a_detailed_study_of_rice_husk_ash_as_an_eco-friendly_substitute_in_cement_production
2025-05-10 01:18:47,sustainable construction materials,D5 digital circular workflow: five digital steps towards matchmaking for material reuse in construction,https://www.nature.com/articles/s44296-024-00034-8
2025-05-10 01:18:47,sustainable construction materials,Microsoft builds first datacenters with wood to slash carbon emissions - Source,https://news.microsoft.com/source/features/sustainability/microsoft-builds-first-datacenters-with-wood-to-slash-carbon-emissions/
2025-05-10 01:18:47,sustainable construction materials,University joins global partnership to transform waste into sustainable construction solution,https://www.manchester.ac.uk/about/news/university-joins-global-partnership-to-transform-waste-into-sustainable-construction-solution/
2025-05-10 01:18:47,sustainable construction materials,Iceland’s National Pavilion at Venice Architecture Biennale Explores Lava as Sustainable Building Material,https://www.archdaily.com/1022861/icelands-national-pavilion-at-venice-architecture-biennale-explores-lava-as-sustainable-building-material
2025-05-10 01:18:47,sustainable construction materials,Biochar: Collaborative research examines the “carbon-eating” building material set to advance sustainable construction,https://www.pbctoday.co.uk/news/mmc-news/biochar-collaborative-research-examines-carbon-eating-building-material-advance-sustainable-construction/144852/
2025-05-10 01:18:47,sustainable construction materials,CRH Ventures Launches “Sustainable Building Materials” Accelerator to Scale Innovative Startups Shaping the Future of the Built World,https://www.businesswire.com/news/home/20241021822864/en/CRH-Ventures-Launches-%E2%80%9CSustainable-Building-Materials%E2%80%9D-Accelerator-to-Scale-Innovative-Startups-Shaping-the-Future-of-the-Built-World
2025-05-10 01:18:47,sustainable construction materials,Green Buildings on the Rise: Why Building Products Matter,https://www.sustainalytics.com/esg-research/resource/investors-esg-blog/green-buildings-on-the-rise--why-building-products-matter
2025-05-10 01:18:47,sustainable construction materials,How this Vancouver heritage home is setting a benchmark for sustainable construction,https://www.biv.com/news/real-estate/how-this-vancouver-heritage-home-set-a-benchmark-for-sustainable-construction-9667798
2025-05-10 01:18:47,sustainable construction materials,Sustainable Construction Materials Market Exclusive Trends Analysis with Forecast to 2031,https://www.openpr.com/news/3696036/sustainable-construction-materials-market-exclusive-trends
2025-05-10 01:18:47,sustainable construction materials,Revolutionizing construction – sustainable wood protection from tree bark waste,https://www.su.se/department-of-materials-and-environmental-chemistry/news/revolutionizing-construction-sustainable-wood-protection-from-tree-bark-waste-1.771114
2025-05-10 01:18:47,sustainable construction materials,Building a sustainable future with steel: ArcelorMittal Construction and Habitat for Humanity’s eco-conscious commitment,https://www.habitat.org/emea/newsroom/2024/building-sustainable-future-steel-arcelormittal-construction-and-habitat-humanitys
2025-05-10 01:18:47,sustainable construction materials,Partanna’s carbon-negative revolution in construction,https://wired.me/science/environment/partanna-sustainable-construction/
2025-05-10 01:18:47,sustainable construction materials,Sustainable construction materials: a new challenge for infrastructure.,https://www.webuildvalue.com/en/thought-leaders-interviews/sustainable-construction-material.html
2025-05-10 01:18:47,sustainable construction materials,Global Market for Green Building Materials Predicted to Reach US$645.5 Billion by 2030,https://www.globenewswire.com/news-release/2024/10/07/2958705/28124/en/Global-Market-for-Green-Building-Materials-Predicted-to-Reach-US-645-5-Billion-by-2030.html
2025-05-10 01:18:47,sustainable construction materials,Why sustainable construction makes commercial sense,https://constructionmanagement.co.uk/why-sustainable-construction-makes-commercial-sense/
2025-05-10 01:18:47,sustainable construction materials,"Sustainable Construction: 60 seconds with...David Kerr, Shell",https://www.imeche.org/news/news-article/sustainable-construction-60-seconds-with-david-kerr-shell
2025-05-10 01:18:47,sustainable construction materials,What Are Sustainable Materials?,https://www.azom.com/article.aspx?ArticleID=24004
2025-05-10 01:18:47,sustainable construction materials,Green materials may lead to sustainable construction,https://www.latrobe.edu.au/news/announcements/2024/green-materials-may-lead-to-sustainable-construction
2025-05-10 01:18:47,sustainable construction materials,How an Industry Leader in Sustainable Building Got His Start,https://www.familyhandyman.com/article/sustainable-building-cordwood-houses/
2025-05-10 01:18:47,sustainable construction materials,"Holcim Sustainable Construction Academy helps drive low-carbon, circular and regenerative design",https://www.holcim.com/who-we-are/our-stories/holcim-sustainable-construction-academy
2025-05-10 01:18:47,sustainable construction materials,Experimental Investigation and Machine Learning Prediction of Mechanical Properties of Rubberized Concrete for Sustainable Construction,https://www.nature.com/articles/s41598-024-73504-7
2025-05-10 01:18:47,sustainable construction materials,"Renovations, sustainable building materials can boost Europe’s green transition",https://www.eea.europa.eu/en/newsroom/news/renovations-sustainable-building-materials
2025-05-10 01:18:47,sustainable construction materials,"Holcim launches Sustainable Construction Academy to drive low-carbon, circular + regenerative design",https://www.climateaction.org/news/holcim-launches-sustainable-construction-academy-to-drive-low-carbon-circul
2025-05-10 01:18:47,sustainable construction materials,8 Innovative Construction Materials,https://parametric-architecture.com/8-innovative-construction-materials/
2025-05-10 01:18:47,sustainable construction materials,Green Building Materials Market to Reach USD 962 Billion by,https://www.globenewswire.com/news-release/2024/09/26/2953815/0/en/Green-Building-Materials-Market-to-Reach-USD-962-Billion-by-2033-Driven-by-Sustainable-Construction-Practices-FMI-Study.html
2025-05-10 01:18:47,sustainable construction materials,Effect of fly ash and ground waste glass as cement replacement in concrete 3D-Printing for sustainable construction,https://www.frontiersin.org/journals/built-environment/articles/10.3389/fbuil.2024.1430174/full
2025-05-10 01:18:47,sustainable construction materials,Top 10: Sustainable Building Materials Companies,https://constructiondigital.com/top10/top-10-sustainable-building-materials-companies
2025-05-10 01:18:47,sustainable construction materials,'Carbon-eating' building materials research set to advance sustainable construction,https://www.hw.ac.uk/news/2024/carbon-eating-building-materials-research-set-to-advance-sustainable-construction
2025-05-10 01:18:47,sustainable construction materials,‘Carbon-eating’ building materials research set to advance sustainable construction,https://www.themanufacturer.com/articles/carbon-eating-building-materials-research-set-to-advance-sustainable-construction/
2025-05-10 01:18:47,sustainable construction materials,Sustainable building groups release policy recommendations for new administration to address challenges in commercial real estate,https://www.usgbc.org/articles/sustainable-building-groups-release-policy-recommendations-new-administration-address
2025-05-10 01:18:47,sustainable construction materials,Innovations in recycled construction materials: paving the way towards sustainable road infrastructure,https://www.frontiersin.org/journals/built-environment/articles/10.3389/fbuil.2024.1449970/full
2025-05-10 01:18:47,sustainable construction materials,Embracing technology for sustainable materials procurement,https://www.pbctoday.co.uk/news/digital-construction-news/construction-technology-news/embracing-technology-sustainable-materials-procurement/143036/
2025-05-10 01:18:47,sustainable construction materials,Are reuseable glass bricks the future of sustainable construction?,https://cosmosmagazine.com/science/engineering/are-reuseable-glass-bricks-the-future-of-sustainable-construction/
2025-05-10 01:18:47,sustainable construction materials,UCL East nets hat-trick of ‘Excellent’ certifications for sustainable construction | UCL News - UCL,https://www.ucl.ac.uk/news/2024/sep/ucl-east-nets-hat-trick-excellent-certifications-sustainable-construction
2025-05-10 01:18:47,sustainable construction materials,Future cities built from molten lava: Innovative concept revealed,https://interestingengineering.com/culture/molten-lava-as-construction-material
2025-05-10 01:18:47,sustainable construction materials,Sustainable Construction in India by Building a Greener Future,https://www.indianretailer.com/article/retail-business/sustainability/sustainable-construction-india-building-greener-future
2025-05-10 01:18:47,sustainable construction materials,Could lava be used as a sustainable building material in the future?,https://www.euronews.com/green/2024/09/13/from-local-threat-to-valuable-resource-could-icelands-lava-be-a-sustainable-building-mater
2025-05-10 01:18:47,sustainable construction materials,Sustainable materials selection in industrial construction: A life-cycle based approach to compare the economic and structural performances of glass fibre reinforced polymer (GFRP) and steel,https://www.sciencedirect.com/science/article/pii/S0959652624030907
2025-05-10 01:18:47,sustainable construction materials,A principal component analysis of corporate dispositions for sustainable building construction in South Africa,https://www.frontiersin.org/journals/built-environment/articles/10.3389/fbuil.2024.1447621/full
2025-05-10 01:18:47,sustainable construction materials,"Infra.Market Becomes India's Largest AAC Block Manufacturer, Sets New Standards in Sustainable Construction",https://www.business-standard.com/content/press-releases-ani/infra-market-becomes-india-s-largest-aac-block-manufacturer-sets-new-standards-in-sustainable-construction-124091000488_1.html
2025-05-10 01:18:47,sustainable construction materials,Sustainable Construction Materials Market Size Estimated to,https://www.globenewswire.com/news-release/2024/09/05/2941469/0/en/Sustainable-Construction-Materials-Market-Size-Estimated-to-Grow-to-USD-645-11-Billion-by-2034-at-11-5-CAGR-Prophecy-Market-Insights.html
2025-05-10 01:18:47,sustainable construction materials,The Army tests whether sustainable building materials have lasting value,https://federalnewsnetwork.com/army/2024/09/the-army-tests-whether-sustainable-building-materials-have-lasting-value/
2025-05-10 01:18:47,sustainable construction materials,Nigerian Researcher Uncovers Key to Sustainable Construction Materials,https://www.thisdaylive.com/index.php/2024/09/02/nigerian-researcher-uncovers-key-to-sustainable-construction-materials/
2025-05-10 01:18:47,sustainable construction materials,"Using sustainable materials is advantageous, so why not?",https://www.researchgate.net/post/Using_sustainable_materials_is_advantageous_so_why_not
2025-05-10 01:18:47,sustainable construction materials,The Role of Sustainability in Construction,https://www.azobuild.com/article.aspx?ArticleID=8694
2025-05-10 01:18:47,sustainable construction materials,"Sustainability targets surge in Britain’s built environment sector, research finds",https://www.edie.net/sustainability-targets-surge-in-britains-built-environment-sector-research-finds/
2025-05-10 01:18:47,sustainable construction materials,"Innovating for the future: USACE uses sustainable building materials for JBLM barracks, enhances Army’s climate resiliency goals",https://www.dvidshub.net/news/478852/innovating-future-usace-uses-sustainable-building-materials-jblm-barracks-enhances-armys-climate-resiliency-goals
2025-05-10 01:18:47,sustainable construction materials,A World Beyond Concrete: 5 Construction Materials India is Using to Make Sustainable Homes,https://thebetterindia.com/361124/rammed-earth-timber-clay-sustainable-home-material-architecture-projects-in-india/
2025-05-10 01:18:47,sustainable construction materials,Covestro LLC and Carlisle Construction Materials Lead the Way in Sustainable Construction Using Bio-attributed Materials,https://www.wkrn.com/business/press-releases/cision/20240816NE85624/covestro-llc-and-carlisle-construction-materials-lead-the-way-in-sustainable-construction-using-bio-attributed-materials/
2025-05-10 01:18:47,sustainable construction materials,Evaluating chemical properties and sustainable recycling of waste foundry sand in construction materials,https://www.frontiersin.org/journals/built-environment/articles/10.3389/fbuil.2024.1386511/full
2025-05-10 01:18:47,sustainable construction materials,The Nordic Region wants to lead the way in sustainable construction,https://www.norden.org/en/news/nordic-region-wants-lead-way-sustainable-construction
2025-05-10 01:18:47,sustainable construction materials,Top 10: Largest Construction Material Manufacturers,https://constructiondigital.com/top10/top-10-largest-construction-material-manufacturers
2025-05-10 01:18:47,sustainable construction materials,Building Blocks to Sustainable Construction,https://www.probuilder.com/business-management/qa/article/55228977/building-blocks-to-sustainable-construction
2025-05-10 01:18:47,sustainable construction materials,Construction materials expert to lead Civil and Architectural Engineering department,https://news.miami.edu/coe/stories/2024/08/construction-materials-expert-to-lead-civil-and-architectural-engineering-department.html
2025-05-10 01:18:47,sustainable construction materials,Adoption of sustainable practices no longer optional: CIDB,https://www.nst.com.my/business/corporate/2024/08/1090154/adoption-sustainable-practices-no-longer-optional-cidb
2025-05-10 01:18:47,sustainable construction materials,Are bio-based materials suitable for mainstream construction?,https://www.burohappold.com/news/are-bio-based-materials-suitable-for-mainstream-construction/
2025-05-10 01:18:47,sustainable construction materials,Evaluating Sustainable Construction Practices in the UAE,https://www.azobuild.com/news.aspx?newsID=23582
2025-05-10 01:18:47,sustainable construction materials,Building better futures together: delivering sustainable buildings with NGOs across the globe,https://www.bond.org.uk/news/2024/08/building-better-futures-together-delivering-sustainable-buildings-with-ngos-across-the-globe/
2025-05-10 01:18:47,sustainable construction materials,Building Better with Data: The Role of Material Libraries in Sustainable Architecture,https://www.archdaily.com/1019364/building-better-with-data-the-role-of-material-libraries-in-sustainable-architecture
2025-05-10 01:18:47,sustainable construction materials,3D concrete printing method could revolutionise sustainable construction,https://www.innovationnewsnetwork.com/3d-concrete-printing-method-could-revolutionise-sustainable-construction/49855/
2025-05-10 01:18:47,sustainable construction materials,Green Cement Surges as Giants Adopt Sustainable Construction,https://constructiondigital.com/sustainability-green-building/green-cement-surges-as-giants-adopt-sustainable-construction
2025-05-10 01:18:47,sustainable construction materials,How cross laminated timber is shaping the future of sustainable construction in Australia,https://www.architectureanddesign.com.au/product/clt-shaping-the-future-of-sustainable-construction
2025-05-10 01:18:47,sustainable construction materials,Steel construction offers pathway to more sustainable buildings,https://www.buildaustralia.com.au/trending/steel-construction-offers-pathway-to-more-sustainable-buildings/
2025-05-10 01:18:47,sustainable construction materials,"Sustainable building materials (SBMs) and their impact on displaced persons health/wellbeing in selected IDP facilities, Nigeria",https://www.frontiersin.org/journals/materials/articles/10.3389/fmats.2024.1337843/full
