Fetched Time,Keyword,Title,Link
2025-05-10 01:18:47,sustainable construction materials,Building Thermal Insulation Market: A Key Contributor to Energy Efficiency and Sustainable Construction,https://www.fmiblog.com/2025/05/09/building-thermal-insulation-market-a-key-contributor-to-energy-efficiency-and-sustainable-construction/
2025-05-10 01:18:47,sustainable construction materials,Celebrating excellence in Small Sustainable Practices at the Sustainability Awards 2025,https://www.architectureanddesign.com.au/editorial/sustainability/celebrating-excellence-in-small-sustainable-practices-at-the-sustainability-awards-2025
2025-05-10 01:18:47,sustainable construction materials,Kingspan and Hydnum Steel Partner for Sustainable Green Steel,https://fuelcellsworks.com/2025/05/08/green-hydrogen/kingspan-joins-forces-with-hydnum-steel-in-strategic-green-steel-partnership
2025-05-10 01:18:47,sustainable construction materials,Vinyl Polymer Plaster,https://market.us/report/polymer-plaster-market/
2025-05-10 01:18:47,sustainable construction materials,How to decarbonize urban India with climate-conscious strategies,https://www.weforum.org/stories/2025/05/decarbonize-urban-india-with-climate-conscious-strategies/
2025-05-10 01:18:47,sustainable construction materials,India Autoclaved Aerated Concrete Blocks Market Trends 2030: Innovations in Lightweight Construction,https://blog.libero.it/wp/satyamtechsci/2025/05/08/india-autoclaved-aerated-concrete-blocks-market-trends-2030-innovations-lightweight-construction/
2025-05-10 01:18:47,sustainable construction materials,How bamboo is redefining sustainable construction in Kenya,https://nation.africa/kenya/business/sustainable-construction-with-bamboo--5032016
2025-05-10 01:18:47,sustainable construction materials,"Bendable Concrete Market Size, Share | CAGR of 40.2%",https://market.us/report/bendable-concrete-market/
2025-05-10 01:18:47,sustainable construction materials,Pollution Absorbing Bricks Market Size | CAGR of 6.3%,https://market.us/report/pollution-absorbing-bricks-market/
2025-05-10 01:18:47,sustainable construction materials,"Op-ed: Yes, you can build sustainable buildings after tariffs",https://www.crainsnewyork.com/op-ed/op-ed-sustainable-buildings-can-rise-after-tariffs
2025-05-10 01:18:47,sustainable construction materials,"Limestone Market Size, Top Share, Growth & Trends Report 2033",https://straitsresearch.com/report/limestone-market
2025-05-10 01:18:47,sustainable construction materials,"Asia Pacific Green Cement Market Size, Share & Trends, 2033",https://www.marketdataforecast.com/market-reports/asia-pacific-green-cement-market
2025-05-10 01:18:47,sustainable construction materials,Sustainability in Construction Market Boosted by Technological Advancements and Eco-Friendly Building Materials,https://www.openpr.com/news/4002639/sustainability-in-construction-market-boosted
2025-05-10 01:18:47,sustainable construction materials,"Green Building Materials Market to Reach USD 1,222 Billion by 2035, Driven by Sustainability and Innovation",https://northeast.newschannelnebraska.com/story/52750117/green-building-materials-market-to-reach-usd-1222-billion-by-2035-driven-by-sustainability-and-innovation
2025-05-10 01:18:47,sustainable construction materials,"New South Philadelphia Soil Cleanwashing Facility Opens, Pioneering Sustainable Construction",https://www.mychesco.com/a/news/regional/new-south-philadelphia-soil-cleanwashing-facility-opens-pioneering-sustainable-construction/
2025-05-10 01:18:47,sustainable construction materials,"“Scientists Create Steel-Like Wood”: This Revolutionary Breakthrough Could Replace Concrete with Iron-Infused Timber, Shaking Up the Construction Industry",https://www.sustainability-times.com/impact/scientists-create-steel-like-wood-this-revolutionary-breakthrough-could-replace-concrete-with-iron-infused-timber-shaking-up-the-construction-industry/
2025-05-10 01:18:47,sustainable construction materials,"Sustainable Construction Materials Market Report 2025-2034: Bamboo Emerges as $214.3 Billion Star in Sustainable Construction as Builders Seek Fast-Growing, Low-Carbon Alternatives",https://finance.yahoo.com/news/sustainable-construction-materials-market-report-160400108.html
2025-05-10 01:18:47,sustainable construction materials,Tata BlueScope Steel Launches PRISMA®: A Sustainable Material,https://chemindigest.com/tata-bluescope-steel-unveils-prisma-a-sustainable-materials/
2025-05-10 01:18:47,sustainable construction materials,Tata BlueScope Steel Launches PRISMA®: A Game-Changer in Sustainable Construction Materials,https://chemindigest.com/tata-bluescope-steel-launches-prisma-a-game-changer-in-sustainable-construction-materials/
2025-05-10 01:18:47,sustainable construction materials,3 sustainable construction considerations for your next Kansas City project,https://www.bizjournals.com/kansascity/news/2025/04/28/sustainable-construction-kansas-city-project.html
2025-05-10 01:18:47,sustainable construction materials,School made from sugarcane waste signals a new era in sustainable construction,https://www.thebrighterside.news/post/school-made-from-sugarcane-waste-signals-a-new-era-in-sustainable-construction/
2025-05-10 01:18:47,sustainable construction materials,Rethinking Sand as Earth Material for a Sustainable Construction in Egypt,https://www.frontiersin.org/journals/built-environment/articles/10.3389/fbuil.2025.1566515/full
2025-05-10 01:18:47,sustainable construction materials,Engineered Biomaterial with Living Cells Offers Sustainable Construction Potential,https://www.azobuild.com/news.aspx?newsID=23773
2025-05-10 01:18:47,sustainable construction materials,Sustainable Construction Materials Market to Grow from $341.9B in 2023 to $687.8B by 2033 at 7.4% CAGR,https://www.openpr.com/news/3973833/sustainable-construction-materials-market-to-grow-from-341-9b
2025-05-10 01:18:47,sustainable construction materials,Sustainable Construction Materials Market Study Analysis with Forecast to 2031,https://www.openpr.com/news/3971802/sustainable-construction-materials-market-study-analysis-with
2025-05-10 01:18:47,sustainable construction materials,"How These Stunning Spaces Stay Cool, Clean the Air & Use Natural Materials Like Lime & Stone",https://thebetterindia.com/419684/sustainable-architecture-in-india-using-stone-lime-moss-the-timber-residence-vagator/
2025-05-10 01:18:47,sustainable construction materials,GPH Ispat and PWD share research on sustainable construction materials,https://www.tbsnews.net/economy/corporates/gph-ispat-and-pwd-share-research-sustainable-construction-materials-1115081
2025-05-10 01:18:47,sustainable construction materials,Enhancing the use of sustainable construction materials in southwest Nigeria: exploring the roles of quantity surveyors,https://www.frontiersin.org/journals/built-environment/articles/10.3389/fbuil.2025.1547125/full
2025-05-10 01:18:47,sustainable construction materials,Metro Vancouver upgrades sustainable building practices,https://www.recyclingproductnews.com/article/43122/construction-plastics-initiative-transforms-construction-waste-into-innovative-building-materials
2025-05-10 01:18:47,sustainable construction materials,"US-based Nigerian researcher unveils sustainable construction materials, water remediation",https://tribuneonlineng.com/us-based-nigerian-researcher-unveils-sustainable-construction-materials-water-remediation/amp/
2025-05-10 01:18:47,sustainable construction materials,Transforming Waste Wood into a High-Strength Construction Material,https://www.azobuild.com/news.aspx?newsID=23759
2025-05-10 01:18:47,sustainable construction materials,Sustainable waste management in the construction industry,https://www.frontiersin.org/journals/sustainable-cities/articles/10.3389/frsc.2025.1582239/full
2025-05-10 01:18:47,sustainable construction materials,Researchers make unbelievable discovery about next-gen construction material that could revolutionize future homes: 'A promising solution',https://tech.yahoo.com/articles/researchers-unbelievable-discovery-next-gen-104503620.html
2025-05-10 01:18:47,sustainable construction materials,Carbon-negative construction creates stronger building materials,https://www.innovationnewsnetwork.com/carbon-negative-construction-creates-stronger-building-materials/56681/
2025-05-10 01:18:47,sustainable construction materials,"Coral-inspired technology turns atmospheric CO₂ into durable, fireproof building materials",https://www.thebrighterside.news/post/coral-inspired-technology-turns-atmospheric-co2-into-durable-fireproof-building-materials/
2025-05-10 01:18:47,sustainable construction materials,Sustainability,https://www.macegroup.com/we-care/sustainability/
2025-05-10 01:18:47,sustainable construction materials,New carbon-negative materials could advance sustainable construction,https://www.innovationnewsnetwork.com/new-carbon-negative-materials-could-advance-sustainable-construction/56515/
2025-05-10 01:18:47,sustainable construction materials,New Carbon-Negative Material Could Make Concrete and Cement More Sustainable,https://www.mccormick.northwestern.edu/news/articles/2025/03/new-carbon-negative-material-could-make-concrete-and-cement-more-sustainable/
2025-05-10 01:18:47,sustainable construction materials,"Bamboo, a sustainable construction material, has massive potential, says expert",https://www.thehindu.com/news/national/andhra-pradesh/bamboo-a-sustainable-construction-material-has-massive-potential-says-expert/article69340987.ece
2025-05-10 01:18:47,sustainable construction materials,New carbon-negative material could make concrete and cement more sustainable,https://news.northwestern.edu/stories/2025/03/new-carbon-negative-material-could-make-concrete-and-cement-more-sustainable/
2025-05-10 01:18:47,sustainable construction materials,A New CCUS Laboratory for Construction Materials Research at UTM,https://news.utm.my/2025/03/a-new-ccus-laboratory-for-construction-materials-research-at-utm/
2025-05-10 01:18:47,sustainable construction materials,Digital tool paves the way for a more sustainable construction industry,https://www.chalmers.se/en/current/news/ims-digital-tool-paves-the-way-for-a-more-sustainable-construction-industry/
2025-05-10 01:18:47,sustainable construction materials,Episode 11: Transforming plastic waste into sustainable building materials with Rui Peng,https://nzbusiness.co.nz/nzbpodcasts/episode-11-transforming-plastic-waste-into-sustainable-building-materials-with-rui-peng
2025-05-10 01:18:47,sustainable construction materials,Fly Ash Market Projected to Reach USD 23.30 Billion by 2032,https://www.globenewswire.com/news-release/2025/03/05/3037509/0/en/Fly-Ash-Market-Projected-to-Reach-USD-23-30-Billion-by-2032-Growing-Demand-for-Sustainable-Construction-Materials-Driving-Growth.html
2025-05-10 01:18:47,sustainable construction materials,WATCH: Panel discussion on sustainable construction materials,https://www.constructionweekonline.com/events/sustainable-construction-panel-discussion
2025-05-10 01:18:47,sustainable construction materials,Eco-friendly materials: the future of residential and commercial construction,https://arizonadigitalfreepress.com/eco-friendly-materials-the-future-of-residential-and-commercial-construction/
2025-05-10 01:18:47,sustainable construction materials,Holcim Mexico mitigate 1.7 million t of CO2 in 2024 with its sustainable construction solutions,https://www.worldcement.com/the-americas/26022025/holcim-mexico-mitigate-17-million-t-of-co-in-2024-with-its-sustainable-construction-solutions/
2025-05-10 01:18:47,sustainable construction materials,From waste to wonder: Revolutionary green grout for sustainable construction practices,https://www.eurekalert.org/news-releases/1074833
2025-05-10 01:18:47,sustainable construction materials,IIT-Bhubaneswar partners with Ramco Cements for sustainable construction,https://infra.economictimes.indiatimes.com/news/construction/iit-bhubaneswar-partners-with-ramco-cements-for-sustainable-construction/118548671
2025-05-10 01:18:47,sustainable construction materials,From Waste to Wonder: Revolutionary Green Grout for Sustainable Construction Practices,https://www.shibaura-it.ac.jp/en/headline/detail/20250212_7070_718.html
2025-05-10 01:18:47,sustainable construction materials,Swedish startup receives funding to transform construction waste into green building materials - ArcticStartup,https://arcticstartup.com/recoma-raises-e2-6-million/
2025-05-10 01:18:47,sustainable construction materials,Evaluating sustainable building assessment systems: a comparative analysis of GBRS and WBLCA,https://www.frontiersin.org/journals/built-environment/articles/10.3389/fbuil.2025.1550733/full
2025-05-10 01:18:47,sustainable construction materials,Transforming Waste to Sustainable Construction Materials,https://www.undp.org/china/transforming-waste-sustainable-construction-materials
2025-05-10 01:18:47,sustainable construction materials,Editorial: Sustainable building materials from recycled cement/concrete and recycled industrial wastes,https://www.frontiersin.org/journals/built-environment/articles/10.3389/fbuil.2025.1573450/full
2025-05-10 01:18:47,sustainable construction materials,Sustainable structures: Top 7 examples of recycled materials in architecture,https://www.pbctoday.co.uk/news/mmc-news/sustainable-structures-top-10-examples-of-recycled-materials-in-architecture/148454/
2025-05-10 01:18:47,sustainable construction materials,BIM-LCA integration: The future of sustainable construction,https://www.pbctoday.co.uk/news/digital-construction-news/bim-news/bim-lca-integration-the-future-of-sustainable-construction/148272/
2025-05-10 01:18:47,sustainable construction materials,How biomaterials are redefining the concept of sustainable design,https://www.pbctoday.co.uk/news/planning-construction-news/how-biomaterials-are-redefining-the-concept-of-sustainable-design/148164/
2025-05-10 01:18:47,sustainable construction materials,Industrial Calcium Byproduct Waste: Sustainable Construction Materials for Building Applications,https://pubs.acs.org/doi/abs/10.1021/acssusresmgt.4c00435
2025-05-10 01:18:47,sustainable construction materials,Top 10: Sustainable Materials,https://manufacturingdigital.com/articles/top-10-sustainable-materials
2025-05-10 01:18:47,sustainable construction materials,How Is Materials Science Shaping the Path to a Greener Future?,https://www.technologynetworks.com/applied-sciences/articles/how-is-materials-science-shaping-the-path-to-a-greener-future-394647
2025-05-10 01:18:47,sustainable construction materials,Unlocking Sustainable Architecture with Wood-Based Materials,https://www.archdaily.com/1026250/unlocking-sustainable-architecture-with-wood-based-materials
2025-05-10 01:18:47,sustainable construction materials,From Landfill to Legacy: Digital Tools Turn Construction Waste into Building Gold,https://www.architectmagazine.com/technology/from-landfill-to-legacy-digital-tools-turn-construction-waste-into-building-gold_o
2025-05-10 01:18:47,sustainable construction materials,Turning ambition into action: Six steps for a more sustainable construction industry,https://resource.co/article/turning-ambition-action-six-steps-more-sustainable-construction-industry
2025-05-10 01:18:47,sustainable construction materials,Iceberg danger prompts call from Actis for more sustainable construction industry,https://www.pbctoday.co.uk/news/building-control-news/iceberg-danger-prompts-call-from-actis-for-more-sustainable-construction-industry/147876/
2025-05-10 01:18:47,sustainable construction materials,"Top 120+ startups in Bio Based Construction Materials in Jan, 2025",https://tracxn.com/d/trending-business-models/startups-in-bio-based-construction-materials/__Z5K47N7539RXcqKYEz4wPr0Ng6vXQi4gp_y75dbIazU/companies
2025-05-10 01:18:47,sustainable construction materials,Nordic Sustainable Construction: Results resonate in the EU,https://www.norden.org/en/news/nordic-sustainable-construction-results-resonate-eu
2025-05-10 01:18:47,sustainable construction materials,How Saudi Arabia is making the construction industry greener and more sustainable,https://www.arabnews.com/node/2587731/saudi-arabia
2025-05-10 01:18:47,sustainable construction materials,"Building and Construction Sheets Industry Report 2024: Global Market to Surpass $285 Billion by 2030, Driven by Rising Demand for Eco-friendly, Lightweight, and Durable Building Materials",https://www.globenewswire.com/news-release/2025/01/23/3014166/28124/en/Building-and-Construction-Sheets-Industry-Report-2024-Global-Market-to-Surpass-285-Billion-by-2030-Driven-by-Rising-Demand-for-Eco-friendly-Lightweight-and-Durable-Building-Materia.html
2025-05-10 01:18:47,sustainable construction materials,"MVRDV ""Carbon Confessions"" Exhibition in Germany Reveals the Realities of Sustainable Construction",https://www.archdaily.com/1026050/mvrdv-carbon-confessions-exhibition-reveals-the-realities-of-sustainable-construction
2025-05-10 01:18:47,sustainable construction materials,A Sustainable Built Environment: Case Studies in Action,https://esgpedia.io/sustainable-built-environment-use-cases-construction/
2025-05-10 01:18:47,sustainable construction materials,Commitment to sustainability,https://www.olympics.com/ioc/olympic-house/commitment-to-sustainability
2025-05-10 01:18:47,sustainable construction materials,Sweden is Building the World’s Largest City Made Entirely From Timber,https://time.com/7207873/sweden-stockholm-wood-city-sustainability/
2025-05-10 01:18:47,sustainable construction materials,"From giant Lego-style bricks to artificial reefs, how the construction industry is using tech to tackle climate change",https://www.cnbc.com/2025/01/17/construction-industry-tackles-climate-change-with-wood-lego-style-bricks-new-materials.html
2025-05-10 01:18:47,sustainable construction materials,Research for climate protection: green construction,https://www.humboldt-foundation.de/en/explore/newsroom/news/research-for-climate-protection-green-construction
2025-05-10 01:18:47,sustainable construction materials,NSW EPA opens consultation on new policy for sustainable construction,https://wastemanagementreview.com.au/nsw-epa-opens-consultation-on-new-policy-for-sustainable-construction/
2025-05-10 01:18:47,sustainable construction materials,ICEC-MCM showcases research impact at final NICER Circular Economy showcase,https://www.ucl.ac.uk/circular-economy-centre-for-construction-minerals/news/2025/jan/icec-mcm-showcases-research-impact-final-nicer-circular-economy-showcase
2025-05-10 01:18:47,sustainable construction materials,"Material passports: the key to carbon reduction, greater component reuse and more sustainable construction",https://www.building.co.uk/focus/material-passports-the-key-to-carbon-reduction-greater-component-reuse-and-more-sustainable-construction/5133468.article
2025-05-10 01:18:47,sustainable construction materials,Building green: how engineered wood is transforming sustainable architecture,https://www.lombardodier.com/insights/2025/january/building-green-how-engineered.html
2025-05-10 01:18:47,sustainable construction materials,Sustainable building components create a good indoor climate,https://ethz.ch/en/news-and-events/eth-news/news/2025/01/sustainable-building-components-create-a-good-indoor-climate.html
2025-05-10 01:18:47,sustainable construction materials,Sustainable building materials create better indoor climates,https://www.innovationnewsnetwork.com/sustainable-building-materials-create-better-indoor-climates/54398/
2025-05-10 01:18:47,sustainable construction materials,"Sustainable Construction Materials Market to record $734.9 Bn by 2032, Says Global Market Insights Inc.",https://www.globenewswire.com/news-release/2025/01/07/3005160/0/en/sustainable-construction-materials-market-to-record-734-9-bn-by-2032-says-global-market-insights-inc.html
2025-05-10 01:18:47,sustainable construction materials,Sustainable Construction Materials Industry Research 2024:,https://www.globenewswire.com/fr/news-release/2025/01/06/3004414/0/en/Sustainable-Construction-Materials-Industry-Research-2024-Global-Market-to-Surpass-456-Billion-by-2028-with-Long-term-Forecasts-to-2033-Green-Certifications-Boost-Growth-Awareness-.html
2025-05-10 01:18:47,sustainable construction materials,Top 10 innovative construction materials shaping the future of building,https://www.pbctoday.co.uk/news/planning-construction-news/top-10-innovative-construction-materials-shaping-the-future-of-building/147192/
2025-05-10 01:18:47,sustainable construction materials,Performance-based construction for sustainable structures,https://www.pbctoday.co.uk/news/digital-construction-news/construction-technology-news/performance-based-construction-for-sustainable-structures/147131/
2025-05-10 01:18:47,sustainable construction materials,High-rises built with wood are showing up as sustainable building options,https://www.marketplace.org/story/2024/12/30/clt-sustainable-building-material-wood-timber-construction-housing-high-rises
2025-05-10 01:18:47,sustainable construction materials,"Europe Low-Carbon Construction Material Industry Research Report 2024: Market Sees Robust Growth, Valued at USD 64.12 Billion in 2023 - Forecast to 2029",https://www.globenewswire.com/news-release/2024/12/26/3001888/28124/en/Europe-Low-Carbon-Construction-Material-Industry-Research-Report-2024-Market-Sees-Robust-Growth-Valued-at-USD-64-12-Billion-in-2023-Forecast-to-2029.html
2025-05-10 01:18:47,sustainable construction materials,High early strength concrete incorporating waste derived nanomaterials for sustainable construction,https://www.nature.com/articles/s41598-024-81178-4
2025-05-10 01:18:47,sustainable construction materials,Fly ash for sustainable construction,https://www.nature.com/collections/ibeiehgjhe
2025-05-10 01:18:47,sustainable construction materials,How to Reduce the Environmental Impact of the Construction Sector,https://www.anthesisgroup.com/insights/environmental-impacts-of-construction/
2025-05-10 01:18:47,sustainable construction materials,Vancouver Tackles Construction Plastic Waste with Circular Solutions,"https://www.environmentenergyleader.com/stories/vancouver-tackles-construction-plastic-waste-with-circular-solutions,60024"
2025-05-10 01:18:47,sustainable construction materials,Robotics and automation for sustainable construction,https://www.pbctoday.co.uk/news/digital-construction-news/construction-technology-news/robotics-and-automation-for-sustainable-construction/147014/
2025-05-10 01:18:47,sustainable construction materials,Construction Sustainability in Ireland – A Path Towards Green Development,https://irishbuildingmagazine.ie/2024/12/16/construction-sustainability-in-ireland-a-path-towards-green-development/
2025-05-10 01:18:47,sustainable construction materials,(PDF) Sustainable Construction Practices: Incorporating Green Materials and Technologies in Civil Engineering Projects,https://www.researchgate.net/publication/387075178_Sustainable_Construction_Practices_Incorporating_Green_Materials_and_Technologies_in_Civil_Engineering_Projects
2025-05-10 01:18:47,sustainable construction materials,Saudi architects turn to rammed earth for sustainable building,https://www.ribaj.com/intelligence/rammed-earth-saudi-arabia-sustainability-heritage-tradition-environment
2025-05-10 01:18:47,sustainable construction materials,The future of sustainable building and construction: Understanding material circularity,https://www.pbctoday.co.uk/news/planning-construction-news/the-future-of-sustainable-building-and-construction-understanding-material-circularity/146564/
2025-05-10 01:18:47,sustainable construction materials,Can We Build Sustainable Cities Without Relying on Cement? These Architects Have Answers,https://thebetterindia.com/386103/sustainable-architecture-in-india-green-pavers-cseb-earth-blocks-orient-stranded-board/
2025-05-10 01:18:47,sustainable construction materials,Karnataka Introduces India's First Circular Economy Policy Mandating Sustainable Construction Materials,https://www.goodreturns.in/news/karnataka-india-first-circular-economy-policy-011-1391945.html
2025-05-10 01:18:47,sustainable construction materials,Karnataka mandates 20% sustainable materials in construction under new policy,https://www.thehindubusinessline.com/news/karnataka-mandates-20-sustainable-materials-in-construction-under-new-policy/article68947093.ece
2025-05-10 01:18:47,sustainable construction materials,From Rubble to Green Building Materials: UK-Ukraine Project Launched,https://www.sheffield.ac.uk/mac/news/rubble-green-building-materials-uk-ukraine-project-launched
2025-05-10 01:18:47,sustainable construction materials,Five green construction trends for 2025,https://www.buildersmerchantsnews.co.uk/Five-green-construction-trends-for-2025/58176
2025-05-10 01:18:47,sustainable construction materials,Building a sustainable home could get more expensive under Trump,https://www.fastcompany.com/91234064/building-a-sustainable-home-could-get-more-expensive-under-trump
2025-05-10 01:18:47,sustainable construction materials,Uncertainty over sustainable buildings and costs stand in the way of Singapore’s green future: Report,https://www.straitstimes.com/singapore/uncertainty-over-sustainable-buildings-and-costs-stand-in-the-way-of-singapore-s-green-future-report
2025-05-10 01:18:47,sustainable construction materials,5 Green Construction Trends for 2025: How Technology is Leading the Way,https://bdcmagazine.com/2024/11/5-green-construction-trends-for-2025-how-technology-is-leading-the-way/
2025-05-10 01:18:47,sustainable construction materials,Innovative Marketing Techniques for Sustainable Construction Companies,https://www.adgully.com/innovative-marketing-techniques-for-sustainable-construction-companies-153149.html
2025-05-10 01:18:47,sustainable construction materials,MIZU Paint Eyes To Be Leader In Sustainable Construction Materials,https://www.bernama.com/en/news.php?id=2364938
